bookTitle,bookUrl,bok_file_Url
صلة الخلف بموصول السلف,http://shamela.ws/index.php/book/26033,http://shamela.ws/books/260/26033.rar
جمع القرآن - دراسة تحليلية لمروياته,http://shamela.ws/index.php/book/37676,http://shamela.ws/books/376/37676.rar
تفسير غريب القرآن - الكواري,http://shamela.ws/index.php/book/37660,http://shamela.ws/books/376/37660.rar
الأحاديث القدسية الأربعينية ت عبد العزيز مختار,http://shamela.ws/index.php/book/37652,http://shamela.ws/books/376/37652.rar
دلائل الإعجاز ت شاكر,http://shamela.ws/index.php/book/12055,http://shamela.ws/books/120/12055.rar
دلائل الإعجاز ت الأيوبي,http://shamela.ws/index.php/book/22664,http://shamela.ws/books/226/22664.rar
دلائل الإعجاز ت هنداوي,http://shamela.ws/index.php/book/37697,http://shamela.ws/books/376/37697.rar
جامع البيان في القراءات السبع,http://shamela.ws/index.php/book/37649,http://shamela.ws/books/376/37649.rar
جمال القراء وكمال الإقراء ت عبد الحق,http://shamela.ws/index.php/book/37653,http://shamela.ws/books/376/37653.rar
جلال الدين السيوطي عصره وحياته وآثاره وجهوده في…,http://shamela.ws/index.php/book/37651,http://shamela.ws/books/376/37651.rar
جماليات المفردة القرآنية,http://shamela.ws/index.php/book/37654,http://shamela.ws/books/376/37654.rar
فكرة الإفريقية الآسيوية,http://shamela.ws/index.php/book/37650,http://shamela.ws/books/376/37650.rar
المسلم في عالم الإقتصاد,http://shamela.ws/index.php/book/37647,http://shamela.ws/books/376/37647.rar
المورد في عمل المولد,http://shamela.ws/index.php/book/36626,http://shamela.ws/books/366/36626.rar
علماء السلف وأهل الوقت,http://shamela.ws/index.php/book/37644,http://shamela.ws/books/376/37644.rar
لسان الميزان ت أبي غدة,http://shamela.ws/index.php/book/36357,http://shamela.ws/books/363/36357.rar
إمعان النظر في مشروعية البغض والهجر,http://shamela.ws/index.php/book/36172,http://shamela.ws/books/361/36172.rar
تنوير المقباس من تفسير ابن عباس,http://shamela.ws/index.php/book/12877,http://shamela.ws/books/128/12877.rar
استيفاء الأقوال في تحريم الإسبال على الرجال,http://shamela.ws/index.php/book/29877,http://shamela.ws/books/298/29877.rar
الاستعداد للموت وسؤال القبر,http://shamela.ws/index.php/book/483,http://shamela.ws/books/004/0483.rar
إحسان سلوك العبد المملوك إلى ملك الملوك,http://shamela.ws/index.php/book/36176,http://shamela.ws/books/361/36176.rar
تكملة معجم المؤلفين,http://shamela.ws/index.php/book/36031,http://shamela.ws/books/360/36031.rar
نفحة اليمن فيما يزول بذكره الشجن,http://shamela.ws/index.php/book/35888,http://shamela.ws/books/358/35888.rar
ما رواه الأساطين في عدم المجيء إلى السلاطين,http://shamela.ws/index.php/book/191,http://shamela.ws/books/001/0191.rar
ذم المكس,http://shamela.ws/index.php/book/36041,http://shamela.ws/books/360/36041.rar
ذم القضاء وتقلد الأحكام,http://shamela.ws/index.php/book/36040,http://shamela.ws/books/360/36040.rar
كتاب الرؤيا,http://shamela.ws/index.php/book/20824,http://shamela.ws/books/208/20824.rar
التفكر والاعتبار بآيات الكسوف والزلازل والإعصار,http://shamela.ws/index.php/book/13443,http://shamela.ws/books/134/13443.rar
معرفة المأمور به والمحذور في زيارة القبور,http://shamela.ws/index.php/book/20687,http://shamela.ws/books/206/20687.rar
أحكام الجراحة الطبية والآثار المترتبة عليها,http://shamela.ws/index.php/book/10815,http://shamela.ws/books/108/10815.rar
السنة ومكانتها للسباعي ط المكتب الإسلامي,http://shamela.ws/index.php/book/37638,http://shamela.ws/books/376/37638.rar
السنة ومكانتها للسباعي ط الوراق,http://shamela.ws/index.php/book/37639,http://shamela.ws/books/376/37639.rar
ردة ولا ابا بكر لها - أبو الحسن الندوي,http://shamela.ws/index.php/book/37637,http://shamela.ws/books/376/37637.rar
علم فهرسة الحديث,http://shamela.ws/index.php/book/37635,http://shamela.ws/books/376/37635.rar
كيفية التعامل مع الفهرس العام لأسماء كتب السنة,http://shamela.ws/index.php/book/37636,http://shamela.ws/books/376/37636.rar
فتاوى يسألونك,http://shamela.ws/index.php/book/9087,http://shamela.ws/books/090/9087.rar
التحفة الربانية في شرح الأربعين حديثا النووية,http://shamela.ws/index.php/book/4469,http://shamela.ws/books/044/4469.rar
هل أنت من المسارعين إلى الخيرات,http://shamela.ws/index.php/book/36530,http://shamela.ws/books/365/36530.rar
نضرة البهار في محاورة الليل والنهار,http://shamela.ws/index.php/book/37633,http://shamela.ws/books/376/37633.rar
نثار الأزهار في الليل والنهار,http://shamela.ws/index.php/book/37632,http://shamela.ws/books/376/37632.rar
مختصر اليمانيات المسلولة على الرافضة المخذولة,http://shamela.ws/index.php/book/37631,http://shamela.ws/books/376/37631.rar
شرح الورقات في أصول الفقه - المحلي,http://shamela.ws/index.php/book/21547,http://shamela.ws/books/215/21547.rar
بيع المرابحة للآمر بالشراء,http://shamela.ws/index.php/book/12784,http://shamela.ws/books/127/12784.rar
الأدلة الشرعية على تحريم مصافحة المرأة الأجنبية,http://shamela.ws/index.php/book/9273,http://shamela.ws/books/092/9273.rar
صلاة الغائب,http://shamela.ws/index.php/book/1723,http://shamela.ws/books/017/1723.rar
نكت وتنبيهات في تفسير القرآن المجيد,http://shamela.ws/index.php/book/1731,http://shamela.ws/books/017/1731.rar
تعريف عام بدين الإسلام,http://shamela.ws/index.php/book/37562,http://shamela.ws/books/375/37562.rar
إلى الإسلام من جديد,http://shamela.ws/index.php/book/37561,http://shamela.ws/books/375/37561.rar
مقتطفات من كتاب من روائع حضارتنا,http://shamela.ws/index.php/book/37563,http://shamela.ws/books/375/37563.rar
بيان العلم الأصيل والمزاحم الدخيل,http://shamela.ws/index.php/book/12796,http://shamela.ws/books/127/12796.rar
دراسات في التصوف,http://shamela.ws/index.php/book/12798,http://shamela.ws/books/127/12798.rar
المنتخب من وصايا الآباء للأبناء,http://shamela.ws/index.php/book/12774,http://shamela.ws/books/127/12774.rar
الجامع الأموي في دمشق,http://shamela.ws/index.php/book/9287,http://shamela.ws/books/092/9287.rar
التصوف - المنشأ والمصادر,http://shamela.ws/index.php/book/5367,http://shamela.ws/books/053/5367.rar
هكذا علمتني الحياة,http://shamela.ws/index.php/book/9267,http://shamela.ws/books/092/9267.rar
شرح القسطلاني = إرشاد الساري لشرح صحيح البخاري,http://shamela.ws/index.php/book/21715,http://shamela.ws/books/217/21715.rar
شرح زاد المستقنع للشنقيطي - كتاب الطهارة,http://shamela.ws/index.php/book/37545,http://shamela.ws/books/375/37545.rar
الرد على الدكتور عبد الواحد وافي في كتابه بين الشيعة…,http://shamela.ws/index.php/book/37553,http://shamela.ws/books/375/37553.rar
المفصل في أحكام العقيقة,http://shamela.ws/index.php/book/37333,http://shamela.ws/books/373/37333.rar
أحكام العقيقة,http://shamela.ws/index.php/book/37555,http://shamela.ws/books/375/37555.rar
يسألونك عن المعاملات المالية المعاصرة,http://shamela.ws/index.php/book/1425,http://shamela.ws/books/014/1425.rar
يسألونك عن رمضان,http://shamela.ws/index.php/book/1436,http://shamela.ws/books/014/1436.rar
اتباع لا ابتداع. . قواعد وأسس في السنة والبدعة,http://shamela.ws/index.php/book/9257,http://shamela.ws/books/092/9257.rar
أحاديث الطائفة الظاهرة,http://shamela.ws/index.php/book/9262,http://shamela.ws/books/092/9262.rar
الخصال المكفرة للذنوب,http://shamela.ws/index.php/book/9279,http://shamela.ws/books/092/9279.rar
المفصل في أحكام الأضحية,http://shamela.ws/index.php/book/9281,http://shamela.ws/books/092/9281.rar
رسالة إنقاذ الهالكين في حكم أخذ الأجرة على تلاوة…,http://shamela.ws/index.php/book/9283,http://shamela.ws/books/092/9283.rar
فقه التاجر المسلم,http://shamela.ws/index.php/book/9289,http://shamela.ws/books/092/9289.rar
يسألونك عن الزكاة,http://shamela.ws/index.php/book/12838,http://shamela.ws/books/128/12838.rar
بذل المجهود في تحرير أسئلة تغير النقود,http://shamela.ws/index.php/book/9282,http://shamela.ws/books/092/9282.rar
مختصر كتاب جلباب المرأة المسلمة,http://shamela.ws/index.php/book/9291,http://shamela.ws/books/092/9291.rar
مسائل مهمات تتعلق بفقه الصوم والتراويح والقراءة…,http://shamela.ws/index.php/book/6351,http://shamela.ws/books/063/6351.rar
الشيعة والسنة,http://shamela.ws/index.php/book/37548,http://shamela.ws/books/375/37548.rar
غيث القلوب ذكر الله تعالى,http://shamela.ws/index.php/book/37543,http://shamela.ws/books/375/37543.rar
الشيعة والقرآن,http://shamela.ws/index.php/book/37550,http://shamela.ws/books/375/37550.rar
الشيعة وأهل البيت,http://shamela.ws/index.php/book/37552,http://shamela.ws/books/375/37552.rar
الرد على الرافضة أو القضاب المشتهر على رقاب ابن…,http://shamela.ws/index.php/book/37554,http://shamela.ws/books/375/37554.rar
التراجم الساقطة من كتاب إكمال تهذيب الكمال لمغلطاي,http://shamela.ws/index.php/book/37551,http://shamela.ws/books/375/37551.rar
بلوغ الغاية من تهذيب بداية الهداية,http://shamela.ws/index.php/book/37549,http://shamela.ws/books/375/37549.rar
الجامع لأحكام الصلاة - عادل بن سعد,http://shamela.ws/index.php/book/37547,http://shamela.ws/books/375/37547.rar
كشف شبهات الصوفية,http://shamela.ws/index.php/book/36165,http://shamela.ws/books/361/36165.rar
عرفوا الحق فتركوا الباطل,http://shamela.ws/index.php/book/36162,http://shamela.ws/books/361/36162.rar
معجم ابن الأعرابي,http://shamela.ws/index.php/book/21494,http://shamela.ws/books/214/21494.rar
تبسيط العقائد الإسلامية,http://shamela.ws/index.php/book/10699,http://shamela.ws/books/106/10699.rar
معجم المعالم الجغرافية في السيرة النبوية,http://shamela.ws/index.php/book/9777,http://shamela.ws/books/097/9777.rar
السيرة النبوية - دروس وعبر,http://shamela.ws/index.php/book/20364,http://shamela.ws/books/203/20364.rar
المرأة بين الفقه والقانون,http://shamela.ws/index.php/book/828,http://shamela.ws/books/008/0828.rar
موسوعة الألباني في العقيدة,http://shamela.ws/index.php/book/36190,http://shamela.ws/books/361/36190.rar
اختصار الأخبار عما كان بثغر سبتة من سني الآثار,http://shamela.ws/index.php/book/36150,http://shamela.ws/books/361/36150.rar
ففروا إلى الله - القلموني,http://shamela.ws/index.php/book/10277,http://shamela.ws/books/102/10277.rar
شرح ألفية ابن مالك للحازمي,http://shamela.ws/index.php/book/36130,http://shamela.ws/books/361/36130.rar
الشرح المختصر على نظم الآجرومية,http://shamela.ws/index.php/book/36106,http://shamela.ws/books/361/36106.rar
الحسام الممدود في الرد على اليهود,http://shamela.ws/index.php/book/37541,http://shamela.ws/books/375/37541.rar
رسالة في حقيقة التأويل,http://shamela.ws/index.php/book/37542,http://shamela.ws/books/375/37542.rar
الأدب الصغير ت خلف,http://shamela.ws/index.php/book/37540,http://shamela.ws/books/375/37540.rar
التوصل إلى حقيقة التوسل,http://shamela.ws/index.php/book/37535,http://shamela.ws/books/375/37535.rar
باهر البرهان فى معانى مشكلات القرآن,http://shamela.ws/index.php/book/37538,http://shamela.ws/books/375/37538.rar
الحجج الباهرة في إفحام الطائفة الكافرة الفاجرة,http://shamela.ws/index.php/book/37537,http://shamela.ws/books/375/37537.rar
أحكام القرآن لابن العربي ط العلمية,http://shamela.ws/index.php/book/1464,http://shamela.ws/books/014/1464.rar
مختصر الفقه الإسلامي في ضوء القرآن والسنة,http://shamela.ws/index.php/book/36185,http://shamela.ws/books/361/36185.rar
موسوعة فقه القلوب,http://shamela.ws/index.php/book/37531,http://shamela.ws/books/375/37531.rar
موسوعة الفقه الإسلامي,http://shamela.ws/index.php/book/37532,http://shamela.ws/books/375/37532.rar
إجلاء الحقيقة في سيرة عائشة الصديقة,http://shamela.ws/index.php/book/36047,http://shamela.ws/books/360/36047.rar
الطرق السلمية في تغير الحاكم الفاسد,http://shamela.ws/index.php/book/37529,http://shamela.ws/books/375/37529.rar
الشاذ والمنكر وزيادة الثقة - موازنة بين المتقدمين…,http://shamela.ws/index.php/book/36147,http://shamela.ws/books/361/36147.rar
عودة الصفويين,http://shamela.ws/index.php/book/37528,http://shamela.ws/books/375/37528.rar
السنة كلها تشريع - موسى شاهين لاشين,http://shamela.ws/index.php/book/36192,http://shamela.ws/books/361/36192.rar
شرح الموقظة للذهبي,http://shamela.ws/index.php/book/36195,http://shamela.ws/books/361/36195.rar
التحرير شرح الدليل - كتاب الطهارة,http://shamela.ws/index.php/book/36194,http://shamela.ws/books/361/36194.rar
الأساليب والإطلاقات العربية,http://shamela.ws/index.php/book/36193,http://shamela.ws/books/361/36193.rar
شريعة الله لا شريعة البشر,http://shamela.ws/index.php/book/36159,http://shamela.ws/books/361/36159.rar
الرد على اللمع,http://shamela.ws/index.php/book/36181,http://shamela.ws/books/361/36181.rar
معاوية بن أبي سفيان أمير المؤمنين وكاتب وحي النبي…,http://shamela.ws/index.php/book/36166,http://shamela.ws/books/361/36166.rar
الشيعة هم العدو فاحذرهم,http://shamela.ws/index.php/book/36168,http://shamela.ws/books/361/36168.rar
المولد النبوي هل نحتفل,http://shamela.ws/index.php/book/36153,http://shamela.ws/books/361/36153.rar
تهذيب اقتضاء الصراط المستقيم,http://shamela.ws/index.php/book/36155,http://shamela.ws/books/361/36155.rar
شم النسيم هل نحتفل,http://shamela.ws/index.php/book/36160,http://shamela.ws/books/361/36160.rar
الصلاة على رسول الله - صلى الله عليه وآله وسلم -…,http://shamela.ws/index.php/book/36170,http://shamela.ws/books/361/36170.rar
جهود علماء الأزهر في بيان حقيقة دين الشيعة = الشيعة…,http://shamela.ws/index.php/book/36173,http://shamela.ws/books/361/36173.rar
أمنا عائشة,http://shamela.ws/index.php/book/36154,http://shamela.ws/books/361/36154.rar
عيد الأم هل نحتفل,http://shamela.ws/index.php/book/36163,http://shamela.ws/books/361/36163.rar
رأس السنة هل نحتفل,http://shamela.ws/index.php/book/36158,http://shamela.ws/books/361/36158.rar
دروس وعبر من صحيح القصص النبوي,http://shamela.ws/index.php/book/36156,http://shamela.ws/books/361/36156.rar
أحكام الصيام والقيام وزكاة الفطر,http://shamela.ws/index.php/book/7807,http://shamela.ws/books/078/7807.rar
المبسوط في القراءات العشر,http://shamela.ws/index.php/book/36104,http://shamela.ws/books/361/36104.rar
الإمام البخاري وفقه التراجم في جامعه الصحيح,http://shamela.ws/index.php/book/36151,http://shamela.ws/books/361/36151.rar
بيان أخطاء المعجم المفهرس لألفاظ الحديث النبوي,http://shamela.ws/index.php/book/36149,http://shamela.ws/books/361/36149.rar
المبشرون والمستشرقون في موقفهم من الإسلام,http://shamela.ws/index.php/book/36148,http://shamela.ws/books/361/36148.rar
الشرح المختصر على نظم المقصود,http://shamela.ws/index.php/book/36120,http://shamela.ws/books/361/36120.rar
الشرح الميسر لزاد المستقنع - كتاب الطهارة للحازمي,http://shamela.ws/index.php/book/36123,http://shamela.ws/books/361/36123.rar
شرح قواعد الأصول ومعاقد الفصول,http://shamela.ws/index.php/book/36103,http://shamela.ws/books/361/36103.rar
الشرح المختصر للسلم المنورق,http://shamela.ws/index.php/book/36056,http://shamela.ws/books/360/36056.rar
شرح منظومة التفسير,http://shamela.ws/index.php/book/36126,http://shamela.ws/books/361/36126.rar
شرح القويسني على السلم المنورق للأخضري,http://shamela.ws/index.php/book/36107,http://shamela.ws/books/361/36107.rar
شرح مائة المعاني والبيان,http://shamela.ws/index.php/book/36098,http://shamela.ws/books/360/36098.rar
شرح المطلع على متن إيساغوجي,http://shamela.ws/index.php/book/36124,http://shamela.ws/books/361/36124.rar
الكنز الأكبر من الأمر بالمعروف والنهي عن المنكر…,http://shamela.ws/index.php/book/36110,http://shamela.ws/books/361/36110.rar
شرح الرحبية للحازمي,http://shamela.ws/index.php/book/36125,http://shamela.ws/books/361/36125.rar
حديث رزية يوم الخميس في الصحيحين,http://shamela.ws/index.php/book/36055,http://shamela.ws/books/360/36055.rar
الذخائر والعبقريات,http://shamela.ws/index.php/book/36072,http://shamela.ws/books/360/36072.rar
ما يجوز للشاعر في الضرورة,http://shamela.ws/index.php/book/36088,http://shamela.ws/books/360/36088.rar
الوجيز النفيس في معرفة التدليس,http://shamela.ws/index.php/book/36051,http://shamela.ws/books/360/36051.rar
اللؤلؤ في الأدب,http://shamela.ws/index.php/book/36077,http://shamela.ws/books/360/36077.rar
فتح رب البرية في شرح نظم الآجرومية,http://shamela.ws/index.php/book/36087,http://shamela.ws/books/360/36087.rar
نداء إلى العفيفات {وأن يستعففن خير لهن},http://shamela.ws/index.php/book/36096,http://shamela.ws/books/360/36096.rar
الاحتجاج بالأثر على من أنكر المهدي المنتظر,http://shamela.ws/index.php/book/36046,http://shamela.ws/books/360/36046.rar
من عجائب الدعاء - الجزء الثاني,http://shamela.ws/index.php/book/26531,http://shamela.ws/books/265/26531.rar
كتاب الشعر أو شرح الأبيات المشكلة الإعراب,http://shamela.ws/index.php/book/37492,http://shamela.ws/books/374/37492.rar
منهج الإمام تاج الدين السبكي في أصول الفقه,http://shamela.ws/index.php/book/35356,http://shamela.ws/books/353/35356.rar
الوحشيات = الحماسة الصغرى,http://shamela.ws/index.php/book/36082,http://shamela.ws/books/360/36082.rar
طبائع الاستبداد ومصارع الاستعباد,http://shamela.ws/index.php/book/36085,http://shamela.ws/books/360/36085.rar
إسبال المطر على قصب السكر نظم نخبة الفكر في مصطلح…,http://shamela.ws/index.php/book/2241,http://shamela.ws/books/022/2241.rar
المفاخرة بين الماء والهواء,http://shamela.ws/index.php/book/36079,http://shamela.ws/books/360/36079.rar
الكلمات البينات في قوله تعالى: {وبشر الذين آمنوا…,http://shamela.ws/index.php/book/36076,http://shamela.ws/books/360/36076.rar
الإسلام والليبرالية نقيضان لا يجتمعان,http://shamela.ws/index.php/book/36043,http://shamela.ws/books/360/36043.rar
الناهية عن طعن أمير المؤمنين معاوية,http://shamela.ws/index.php/book/36080,http://shamela.ws/books/360/36080.rar
الأساليب البديعة في فضل الصحابة وإقناع الشيعة,http://shamela.ws/index.php/book/36070,http://shamela.ws/books/360/36070.rar
تاريخ البيمارستانات في الإسلام,http://shamela.ws/index.php/book/36083,http://shamela.ws/books/360/36083.rar
من عجائب الدعاء - الجزء الأول,http://shamela.ws/index.php/book/36095,http://shamela.ws/books/360/36095.rar
الشفاء في بديع الاكتفاء,http://shamela.ws/index.php/book/36073,http://shamela.ws/books/360/36073.rar
عمدة الكتاب وعدة ذوي الألباب,http://shamela.ws/index.php/book/36086,http://shamela.ws/books/360/36086.rar
الفلاكة والمفلوكون,http://shamela.ws/index.php/book/36075,http://shamela.ws/books/360/36075.rar
النكت الشنيعة في بيان الخلاف بين الله تعالى والشيعة,http://shamela.ws/index.php/book/36081,http://shamela.ws/books/360/36081.rar
العتاب بين الأصدقاء,http://shamela.ws/index.php/book/36074,http://shamela.ws/books/360/36074.rar
أوقات مليئة بالحسنات مع النية الصالحة,http://shamela.ws/index.php/book/36042,http://shamela.ws/books/360/36042.rar
مختصر التحفة الاثني عشرية,http://shamela.ws/index.php/book/36091,http://shamela.ws/books/360/36091.rar
الأجوبة العراقية على الأسئلة اللاهورية,http://shamela.ws/index.php/book/36066,http://shamela.ws/books/360/36066.rar
شرح الأثيوبي على ألفية السيوطي في الحديث = إسعاف…,http://shamela.ws/index.php/book/10312,http://shamela.ws/books/103/10312.rar
موجز التاريخ الإسلامي من عهد آدم إلى عصرنا الحاضر,http://shamela.ws/index.php/book/73353,http://shamela.ws/books/733/73353.rar
فتح الباقي بشرح ألفية العراقي,http://shamela.ws/index.php/book/35261,http://shamela.ws/books/352/35261.rar
أجوبة التسولي عن مسائل الأمير عبد القادر في الجهاد,http://shamela.ws/index.php/book/35276,http://shamela.ws/books/352/35276.rar
السُنَّة المطهرة والتحديات,http://shamela.ws/index.php/book/36617,http://shamela.ws/books/366/36617.rar
الجرح والتعديل للقاسمي,http://shamela.ws/index.php/book/36616,http://shamela.ws/books/366/36616.rar
أم المؤمنين زينب بنت جحش,http://shamela.ws/index.php/book/36567,http://shamela.ws/books/365/36567.rar
تلخيص صفة صلاة النبي صلى الله عليه وآله وسلم,http://shamela.ws/index.php/book/10095,http://shamela.ws/books/100/10095.rar
التلخيص في معرفة أسماء الأشياء,http://shamela.ws/index.php/book/37471,http://shamela.ws/books/374/37471.rar
شرح الطحاوية - ط دار السلام,http://shamela.ws/index.php/book/10549,http://shamela.ws/books/105/10549.rar
شعب الإيمان,http://shamela.ws/index.php/book/10660,http://shamela.ws/books/106/10660.rar
شرح الطحاوية - ط الأوقاف السعودية,http://shamela.ws/index.php/book/10777,http://shamela.ws/books/107/10777.rar
الرسالة العرشية,http://shamela.ws/index.php/book/10784,http://shamela.ws/books/107/10784.rar
تفسير القرطبي,http://shamela.ws/index.php/book/20855,http://shamela.ws/books/208/20855.rar
لله ثم للتاريخ = كشف الأسرار وتبرئة الأئمة الأطهار,http://shamela.ws/index.php/book/3952,http://shamela.ws/books/039/3952.rar
قرة العين بفتاوى علماء الحرمين,http://shamela.ws/index.php/book/36569,http://shamela.ws/books/365/36569.rar
شرح القصائد العشر,http://shamela.ws/index.php/book/37488,http://shamela.ws/books/374/37488.rar
تاريخ نزول القرآن,http://shamela.ws/index.php/book/37483,http://shamela.ws/books/374/37483.rar
فتاوى الأئمة في النوازل المدلهمة,http://shamela.ws/index.php/book/36570,http://shamela.ws/books/365/36570.rar
الأجوبة الكافية عن الأسئلة الشامية,http://shamela.ws/index.php/book/36571,http://shamela.ws/books/365/36571.rar
الإتباع,http://shamela.ws/index.php/book/37469,http://shamela.ws/books/374/37469.rar
قشر الفسر,http://shamela.ws/index.php/book/37491,http://shamela.ws/books/374/37491.rar
الجامع الكبير في صناعة المنظوم من الكلام والمنثور,http://shamela.ws/index.php/book/37475,http://shamela.ws/books/374/37475.rar
ضرائر الشعر,http://shamela.ws/index.php/book/37489,http://shamela.ws/books/374/37489.rar
التحف الربانية في جواب الأسئلة اللمدانية,http://shamela.ws/index.php/book/36572,http://shamela.ws/books/365/36572.rar
