bookTitle,bookUrl,bok_file_Url
الأحاديث السباعيات الألف للشحامي - مخطوط (ن),http://shamela.ws/index.php/book/10444,http://shamela.ws/books/104/10444.rar
رقية الأبرار,http://shamela.ws/index.php/book/10446,http://shamela.ws/books/104/10446.rar
الأربعون الأبدال التساعيات للبخاري ومسلم للدمياطي…,http://shamela.ws/index.php/book/10447,http://shamela.ws/books/104/10447.rar
الأحكام الملمة على الدروس المهمة لعامة الأمة,http://shamela.ws/index.php/book/10448,http://shamela.ws/books/104/10448.rar
تذكرة الأريب في تفسير الغريب,http://shamela.ws/index.php/book/10450,http://shamela.ws/books/104/10450.rar
مغاني الأخيار في شرح أسامي رجال معاني الآثار,http://shamela.ws/index.php/book/10452,http://shamela.ws/books/104/10452.rar
قائمة بمؤلفات شيخ الإسلام المطبوعة,http://shamela.ws/index.php/book/10457,http://shamela.ws/books/104/10457.rar
القول السديد شرح كتاب التوحيد ط الوزارة,http://shamela.ws/index.php/book/10458,http://shamela.ws/books/104/10458.rar
جمال القراء وكمال الإقراء,http://shamela.ws/index.php/book/10460,http://shamela.ws/books/104/10460.rar
مناقب الإمام أبي حنيفة وصاحبيه,http://shamela.ws/index.php/book/10461,http://shamela.ws/books/104/10461.rar
تفسير ابن رجب الحنبلي,http://shamela.ws/index.php/book/10463,http://shamela.ws/books/104/10463.rar
الأربعين المسلسلة المتباينة الأسانيد ليوسف بن…,http://shamela.ws/index.php/book/10469,http://shamela.ws/books/104/10469.rar
التعليق على فتح الباري,http://shamela.ws/index.php/book/10470,http://shamela.ws/books/104/10470.rar
اعتقاد أهل السنة شرح أصحاب الحديث,http://shamela.ws/index.php/book/10471,http://shamela.ws/books/104/10471.rar
اعتقاد أئمة الحديث,http://shamela.ws/index.php/book/10472,http://shamela.ws/books/104/10472.rar
الأمالي لمرتضى الزبيدي - مخطوط (ن),http://shamela.ws/index.php/book/10479,http://shamela.ws/books/104/10479.rar
لأحاديث المختارة = المستخرج من الأحاديث المختارة…,http://shamela.ws/index.php/book/10480,http://shamela.ws/books/104/10480.rar
التوكل وسؤال الله عز وجل لعبد الغني المقدسي - مخطوط…,http://shamela.ws/index.php/book/10482,http://shamela.ws/books/104/10482.rar
ألفية السيوطي في علم الحديث ت ماهر الفحل,http://shamela.ws/index.php/book/10483,http://shamela.ws/books/104/10483.rar
الجزء 13 من حديث أبي طاهر الذهلي انتقاء الدارقطي-…,http://shamela.ws/index.php/book/10485,http://shamela.ws/books/104/10485.rar
شرح صحيح البخارى لابن بطال,http://shamela.ws/index.php/book/10486,http://shamela.ws/books/104/10486.rar
الإبطال لنظرية الخلط بين دين الإسلام وغيره من الأديان,http://shamela.ws/index.php/book/10487,http://shamela.ws/books/104/10487.rar
تنبيه الغافلين بأحاديث سيد الأنبياء والمرسلين…,http://shamela.ws/index.php/book/10488,http://shamela.ws/books/104/10488.rar
معرفة الصحابة لأبي نعيم,http://shamela.ws/index.php/book/10490,http://shamela.ws/books/104/10490.rar
الجزء الثالث من فوائد أبي علي الصواف - 80 % مخطوط,http://shamela.ws/index.php/book/10492,http://shamela.ws/books/104/10492.rar
الجزء الثاني من الحربيات لعلي بن عمر الحربي - مخطوط…,http://shamela.ws/index.php/book/10494,http://shamela.ws/books/104/10494.rar
لباب الآداب لأسامة بن منقذ,http://shamela.ws/index.php/book/10496,http://shamela.ws/books/104/10496.rar
الأمثال المولدة,http://shamela.ws/index.php/book/10497,http://shamela.ws/books/104/10497.rar
الجزء الثاني من حديث أبي محمد حاجب بن أحمد الطوسي-…,http://shamela.ws/index.php/book/10498,http://shamela.ws/books/104/10498.rar
الحدود والتعزيرات عند ابن القيم,http://shamela.ws/index.php/book/10500,http://shamela.ws/books/105/10500.rar
البخلاء للجاحظ,http://shamela.ws/index.php/book/10501,http://shamela.ws/books/105/10501.rar
البغال,http://shamela.ws/index.php/book/10506,http://shamela.ws/books/105/10506.rar
الفاضل,http://shamela.ws/index.php/book/10508,http://shamela.ws/books/105/10508.rar
اللطائف والظرائف,http://shamela.ws/index.php/book/10509,http://shamela.ws/books/105/10509.rar
المحاسن والأضداد,http://shamela.ws/index.php/book/10511,http://shamela.ws/books/105/10511.rar
روض الأخيار المنتخب من ربيع الأبرار,http://shamela.ws/index.php/book/10512,http://shamela.ws/books/105/10512.rar
الجزء الرابع من الثقفيات للقاسم بن الفضل الثقفي…,http://shamela.ws/index.php/book/10514,http://shamela.ws/books/105/10514.rar
الجزء الرابع من الفوائد المنتقاة العوالي من حديث…,http://shamela.ws/index.php/book/10515,http://shamela.ws/books/105/10515.rar
فتاوى د حسام عفانة,http://shamela.ws/index.php/book/10517,http://shamela.ws/books/105/10517.rar
طوق الحمامة لابن حزم,http://shamela.ws/index.php/book/10518,http://shamela.ws/books/105/10518.rar
الإمتاع والمؤانسة,http://shamela.ws/index.php/book/10521,http://shamela.ws/books/105/10521.rar
تفسير ابن فورك,http://shamela.ws/index.php/book/10523,http://shamela.ws/books/105/10523.rar
إنباه الرواة على أنباه النحاة,http://shamela.ws/index.php/book/10525,http://shamela.ws/books/105/10525.rar
معالم القربة في طلب الحسبة,http://shamela.ws/index.php/book/10526,http://shamela.ws/books/105/10526.rar
مشارق الأنوار على صحاح الآثار,http://shamela.ws/index.php/book/10527,http://shamela.ws/books/105/10527.rar
الأوائل للعسكري,http://shamela.ws/index.php/book/10529,http://shamela.ws/books/105/10529.rar
أخلاق أهل القرآن,http://shamela.ws/index.php/book/10531,http://shamela.ws/books/105/10531.rar
الأوراق قسم أخبار الشعراء,http://shamela.ws/index.php/book/10532,http://shamela.ws/books/105/10532.rar
الأمثال للهاشمي,http://shamela.ws/index.php/book/10533,http://shamela.ws/books/105/10533.rar
البرصان والعرجان والعميان والحولان,http://shamela.ws/index.php/book/10538,http://shamela.ws/books/105/10538.rar
المقال وتطوره في الأدب المعاصر,http://shamela.ws/index.php/book/10540,http://shamela.ws/books/105/10540.rar
إصلاح المساجد من البدع والعوائد,http://shamela.ws/index.php/book/10541,http://shamela.ws/books/105/10541.rar
الضعفاء الصغير للبخاري ت زايد,http://shamela.ws/index.php/book/10542,http://shamela.ws/books/105/10542.rar
فنون التحرير الصحفي بين النظرية والتطبيق المقال…,http://shamela.ws/index.php/book/10543,http://shamela.ws/books/105/10543.rar
المنصف لابن جني، شرح كتاب التصريف لأبي عثمان المازني,http://shamela.ws/index.php/book/10545,http://shamela.ws/books/105/10545.rar
المدارس النحوية,http://shamela.ws/index.php/book/10546,http://shamela.ws/books/105/10546.rar
المذاهب الفكرية المعاصرة ودورها في المجتمعات وموقف…,http://shamela.ws/index.php/book/10547,http://shamela.ws/books/105/10547.rar
تاريخ آداب العرب,http://shamela.ws/index.php/book/10548,http://shamela.ws/books/105/10548.rar
الفلك الدائر على المثل السائر,http://shamela.ws/index.php/book/10550,http://shamela.ws/books/105/10550.rar
المثل السائر في أدب الكاتب والشاعر ت الحوفي,http://shamela.ws/index.php/book/10551,http://shamela.ws/books/105/10551.rar
السيرة النبوية والدعوة في العهد المكي,http://shamela.ws/index.php/book/10552,http://shamela.ws/books/105/10552.rar
العملية الإرشادية,http://shamela.ws/index.php/book/10553,http://shamela.ws/books/105/10553.rar
رسالة إلى المدرسين والمدرسات,http://shamela.ws/index.php/book/10609,http://shamela.ws/books/106/10609.rar
البيان والتبيين,http://shamela.ws/index.php/book/10614,http://shamela.ws/books/106/10614.rar
تنبيه القارئ,http://shamela.ws/index.php/book/10618,http://shamela.ws/books/106/10618.rar
اللؤلؤ والمرجان فيما اتفق عليه الشيخان,http://shamela.ws/index.php/book/10619,http://shamela.ws/books/106/10619.rar
الأربعون لمحمد بن أسلم الطوسي,http://shamela.ws/index.php/book/10620,http://shamela.ws/books/106/10620.rar
القبور لابن أبي الدنيا,http://shamela.ws/index.php/book/10628,http://shamela.ws/books/106/10628.rar
المنتخب من مسند عبد بن حميد ت مصطفى العدوي,http://shamela.ws/index.php/book/10631,http://shamela.ws/books/106/10631.rar
الجواهر الغوالي في ذكر الأسانيد العوالي للبديري…,http://shamela.ws/index.php/book/10632,http://shamela.ws/books/106/10632.rar
فضائح الصوفية,http://shamela.ws/index.php/book/10636,http://shamela.ws/books/106/10636.rar
دلائل النبوة لأبي نعيم الأصبهاني,http://shamela.ws/index.php/book/10637,http://shamela.ws/books/106/10637.rar
الإيمان للقاسم بن سلام - مخرجا,http://shamela.ws/index.php/book/10638,http://shamela.ws/books/106/10638.rar
الأذكار للنووي ط ابن حزم,http://shamela.ws/index.php/book/10639,http://shamela.ws/books/106/10639.rar
التوقيف على مهمات التعاريف,http://shamela.ws/index.php/book/10640,http://shamela.ws/books/106/10640.rar
النحو الوافي,http://shamela.ws/index.php/book/10641,http://shamela.ws/books/106/10641.rar
التذكرة الحمدونية,http://shamela.ws/index.php/book/10646,http://shamela.ws/books/106/10646.rar
الشرح الممتع على زاد المستقنع,http://shamela.ws/index.php/book/10649,http://shamela.ws/books/106/10649.rar
جامع تفاسير الأحلام = تنبيه الأفهام بتأويل الأحلام,http://shamela.ws/index.php/book/10652,http://shamela.ws/books/106/10652.rar
تنقيح التحقيق لابن عبد الهادي,http://shamela.ws/index.php/book/10657,http://shamela.ws/books/106/10657.rar
مسانيد فراس المكتب,http://shamela.ws/index.php/book/10659,http://shamela.ws/books/106/10659.rar
حياة الحيوان الكبرى,http://shamela.ws/index.php/book/10664,http://shamela.ws/books/106/10664.rar
دمية القصر وعصرة أهل العصر,http://shamela.ws/index.php/book/10665,http://shamela.ws/books/106/10665.rar
ربيع الأبرار ونصوص الأخيار,http://shamela.ws/index.php/book/10668,http://shamela.ws/books/106/10668.rar
الرسائل الأدبية,http://shamela.ws/index.php/book/10670,http://shamela.ws/books/106/10670.rar
الدرر في اختصار المغازي والسير,http://shamela.ws/index.php/book/10695,http://shamela.ws/books/106/10695.rar
تعبير الرؤيا (مخطوط),http://shamela.ws/index.php/book/10696,http://shamela.ws/books/106/10696.rar
الإشارة إلى علم العبارة (مخطوط),http://shamela.ws/index.php/book/10698,http://shamela.ws/books/106/10698.rar
قواعد تفسير الأحلام = البدر المنير في علم التعبير,http://shamela.ws/index.php/book/10703,http://shamela.ws/books/107/10703.rar
الحاوي في الطب,http://shamela.ws/index.php/book/10704,http://shamela.ws/books/107/10704.rar
العلاج بالأعشاب,http://shamela.ws/index.php/book/10705,http://shamela.ws/books/107/10705.rar
القانون في الطب,http://shamela.ws/index.php/book/10706,http://shamela.ws/books/107/10706.rar
الرسائل السياسية,http://shamela.ws/index.php/book/10709,http://shamela.ws/books/107/10709.rar
رسائل المقريزي,http://shamela.ws/index.php/book/10710,http://shamela.ws/books/107/10710.rar
أسماء مؤلفات شيخ الإسلام ابن تيمية,http://shamela.ws/index.php/book/10713,http://shamela.ws/books/107/10713.rar
المعجم المفهرس = تجريد أسانيد الكتب المشهورة والأجزاء…,http://shamela.ws/index.php/book/10714,http://shamela.ws/books/107/10714.rar
الحطة في ذكر الصحاح الستة,http://shamela.ws/index.php/book/10717,http://shamela.ws/books/107/10717.rar
أدب المفتي والمستفتي,http://shamela.ws/index.php/book/10720,http://shamela.ws/books/107/10720.rar
فهرسة ابن خير الإشبيلي,http://shamela.ws/index.php/book/10726,http://shamela.ws/books/107/10726.rar
فهرس ابن عطية,http://shamela.ws/index.php/book/10728,http://shamela.ws/books/107/10728.rar
قطف الثمر في رفع أسانيد المصنفات,http://shamela.ws/index.php/book/10730,http://shamela.ws/books/107/10730.rar
فهرسة اللبلي,http://shamela.ws/index.php/book/10731,http://shamela.ws/books/107/10731.rar
فهرسة علي بن خليفة المساكني,http://shamela.ws/index.php/book/10732,http://shamela.ws/books/107/10732.rar
إتمام الدراية لقراء النقاية,http://shamela.ws/index.php/book/10733,http://shamela.ws/books/107/10733.rar
اسماء الكتب المتمم لكشف الظنون,http://shamela.ws/index.php/book/10734,http://shamela.ws/books/107/10734.rar
برنامج المجاري,http://shamela.ws/index.php/book/10735,http://shamela.ws/books/107/10735.rar
ثبت أبي جعفر أحمد بن علي,http://shamela.ws/index.php/book/10736,http://shamela.ws/books/107/10736.rar
معجم الكتب,http://shamela.ws/index.php/book/10737,http://shamela.ws/books/107/10737.rar
لقطة العجلان مما تمس إلى معرفته حاجة الإنسان,http://shamela.ws/index.php/book/10739,http://shamela.ws/books/107/10739.rar
برنامج الوادي آشي,http://shamela.ws/index.php/book/10740,http://shamela.ws/books/107/10740.rar
النظام القضائي في الفقه الإسلامي,http://shamela.ws/index.php/book/10744,http://shamela.ws/books/107/10744.rar
حاضر العالم الإسلامي,http://shamela.ws/index.php/book/10746,http://shamela.ws/books/107/10746.rar
نور اللمعة في خصائص الجمعة,http://shamela.ws/index.php/book/10747,http://shamela.ws/books/107/10747.rar
اللغة وعلم اللغة,http://shamela.ws/index.php/book/10748,http://shamela.ws/books/107/10748.rar
علم نفس النمو من الجنين إلى الشيخوخة,http://shamela.ws/index.php/book/10751,http://shamela.ws/books/107/10751.rar
دعوة الرسل عليهم السلام,http://shamela.ws/index.php/book/10752,http://shamela.ws/books/107/10752.rar
مجالس شهر رمضان,http://shamela.ws/index.php/book/10756,http://shamela.ws/books/107/10756.rar
صحيح الجامع الصغير وزيادته,http://shamela.ws/index.php/book/10757,http://shamela.ws/books/107/10757.rar
الفوائد الجليلة في مسلسلات ابن عقيلة,http://shamela.ws/index.php/book/10758,http://shamela.ws/books/107/10758.rar
أحكام القرآن للطحاوي,http://shamela.ws/index.php/book/10765,http://shamela.ws/books/107/10765.rar
علم أصول الفقه ط مكتبة الدعوة,http://shamela.ws/index.php/book/10767,http://shamela.ws/books/107/10767.rar
زهر الآداب وثمر الألباب,http://shamela.ws/index.php/book/10768,http://shamela.ws/books/107/10768.rar
فقه النوازل,http://shamela.ws/index.php/book/10776,http://shamela.ws/books/107/10776.rar
المسلسلات المختصرة المقدمة أمام المجالس المبتكرة,http://shamela.ws/index.php/book/10778,http://shamela.ws/books/107/10778.rar
الخطابة الإسلامية,http://shamela.ws/index.php/book/10779,http://shamela.ws/books/107/10779.rar
شرح مختصر الروضة,http://shamela.ws/index.php/book/10781,http://shamela.ws/books/107/10781.rar
كشف الكربة في وصف أهل الغربة,http://shamela.ws/index.php/book/10782,http://shamela.ws/books/107/10782.rar
المسالك والممالك للاصطخري أو مسالك الممالك - ليدن,http://shamela.ws/index.php/book/10791,http://shamela.ws/books/107/10791.rar
الاشارات الى معرفة الزيارات,http://shamela.ws/index.php/book/10797,http://shamela.ws/books/107/10797.rar
بغية الطلب فى تاريخ حلب,http://shamela.ws/index.php/book/10798,http://shamela.ws/books/107/10798.rar
فضائل رمضان لابن أبي الدنيا,http://shamela.ws/index.php/book/10799,http://shamela.ws/books/107/10799.rar
الإحكام في أصول الأحكام للآمدي,http://shamela.ws/index.php/book/10801,http://shamela.ws/books/108/10801.rar
الضعفاء والمتروكون للدارقطني,http://shamela.ws/index.php/book/10802,http://shamela.ws/books/108/10802.rar
الأنوار في شمائل النبي المختار,http://shamela.ws/index.php/book/10803,http://shamela.ws/books/108/10803.rar
الضعفاء والمتروكون للنسائي,http://shamela.ws/index.php/book/10805,http://shamela.ws/books/108/10805.rar
حماسة الخالديين = الأشباه والنظائر من أشعار المتقدمين…,http://shamela.ws/index.php/book/10806,http://shamela.ws/books/108/10806.rar
البلدان لليعقوبي,http://shamela.ws/index.php/book/10808,http://shamela.ws/books/108/10808.rar
حدود العالم من المشرق الى المغرب,http://shamela.ws/index.php/book/10809,http://shamela.ws/books/108/10809.rar
إشكال وجوابه في حديث أم حرام بنت ملحان,http://shamela.ws/index.php/book/10814,http://shamela.ws/books/108/10814.rar
بغية الملتمس في سباعيات حديث الإمام مالك بن أنس,http://shamela.ws/index.php/book/10826,http://shamela.ws/books/108/10826.rar
الضوء الساري في معرفة خبر تميم الداري للمقريزي…,http://shamela.ws/index.php/book/10830,http://shamela.ws/books/108/10830.rar
العوالي لشمس الدين الجزري - مخطوط (ن),http://shamela.ws/index.php/book/10831,http://shamela.ws/books/108/10831.rar
الفوائد المنتقاة الحسان للخلعي (الخلعيات) رواية…,http://shamela.ws/index.php/book/10835,http://shamela.ws/books/108/10835.rar
الفصل للوصل المدرج في النقل,http://shamela.ws/index.php/book/10842,http://shamela.ws/books/108/10842.rar
تعليقات الدارقطني على المجروحين لابن حبان,http://shamela.ws/index.php/book/10843,http://shamela.ws/books/108/10843.rar
سلسلة الذهب,http://shamela.ws/index.php/book/6023,http://shamela.ws/books/060/6023.rar
موضح أوهام الجمع والتفريق,http://shamela.ws/index.php/book/6025,http://shamela.ws/books/060/6025.rar
المدخل إلى الصحيح,http://shamela.ws/index.php/book/6027,http://shamela.ws/books/060/6027.rar
فضائل سنن الترمذي,http://shamela.ws/index.php/book/6028,http://shamela.ws/books/060/6028.rar
الإلماع إلى معرفة أصول الرواية وتقييد السماع,http://shamela.ws/index.php/book/6030,http://shamela.ws/books/060/6030.rar
الوجيز في ذكر المجاز والمجيز,http://shamela.ws/index.php/book/6031,http://shamela.ws/books/060/6031.rar
كشف المغطا في فضل الموطا,http://shamela.ws/index.php/book/6032,http://shamela.ws/books/060/6032.rar
القول المسدد في الذب عن مسند أحمد,http://shamela.ws/index.php/book/6035,http://shamela.ws/books/060/6035.rar
مشكلات موطأ مالك بن أنس,http://shamela.ws/index.php/book/6037,http://shamela.ws/books/060/6037.rar
العلل لابن المديني,http://shamela.ws/index.php/book/6038,http://shamela.ws/books/060/6038.rar
طلبة الطلبة في الاصطلاحات الفقهية,http://shamela.ws/index.php/book/6039,http://shamela.ws/books/060/6039.rar
تحسين القبيح وتقبيح الحسن,http://shamela.ws/index.php/book/6040,http://shamela.ws/books/060/6040.rar
العلل ومعرفة الرجال لأحمد رواية المروذي وغيره…,http://shamela.ws/index.php/book/6044,http://shamela.ws/books/060/6044.rar
التمييز لمسلم,http://shamela.ws/index.php/book/6048,http://shamela.ws/books/060/6048.rar
علل الأحاديث في صحيح مسلم,http://shamela.ws/index.php/book/6049,http://shamela.ws/books/060/6049.rar
الفوائد الموضوعة في الأحاديث الموضوعة,http://shamela.ws/index.php/book/6051,http://shamela.ws/books/060/6051.rar
الآثار المرفوعة في الأخبار الموضوعة,http://shamela.ws/index.php/book/6053,http://shamela.ws/books/060/6053.rar
الأسرار المرفوعة في الأخبار الموضوعة,http://shamela.ws/index.php/book/6056,http://shamela.ws/books/060/6056.rar
ذخيرة الحفاظ,http://shamela.ws/index.php/book/6060,http://shamela.ws/books/060/6060.rar
اللآلىء المصنوعة في الأحاديث الموضوعة,http://shamela.ws/index.php/book/6062,http://shamela.ws/books/060/6062.rar
اللؤلؤ المرصوع,http://shamela.ws/index.php/book/6063,http://shamela.ws/books/060/6063.rar
المصنوع في معرفة الحديث الموضوع,http://shamela.ws/index.php/book/6064,http://shamela.ws/books/060/6064.rar
تلخيص كتاب الموضوعات,http://shamela.ws/index.php/book/6068,http://shamela.ws/books/060/6068.rar
الموضوعات للصغاني,http://shamela.ws/index.php/book/6070,http://shamela.ws/books/060/6070.rar
أحاديث مختارة من موضوعات الجورقاني وابن الجوزي,http://shamela.ws/index.php/book/6071,http://shamela.ws/books/060/6071.rar
الفردوس بمأثور الخطاب,http://shamela.ws/index.php/book/6072,http://shamela.ws/books/060/6072.rar
تحذير الخواص من أكاذيب القصاص,http://shamela.ws/index.php/book/6073,http://shamela.ws/books/060/6073.rar
عمدة الأحكام من كلام خير الأنام صلى الله عليه وسلم,http://shamela.ws/index.php/book/6075,http://shamela.ws/books/060/6075.rar
أسنى المطالب في أحاديث مختلفة المراتب,http://shamela.ws/index.php/book/6076,http://shamela.ws/books/060/6076.rar
الجد الحثيث في بيان ما ليس بحديث,http://shamela.ws/index.php/book/6077,http://shamela.ws/books/060/6077.rar
النخبة البهية في الأحاديث المكذوبة على خير البرية,http://shamela.ws/index.php/book/6079,http://shamela.ws/books/060/6079.rar
معرفة التذكرة,http://shamela.ws/index.php/book/6080,http://shamela.ws/books/060/6080.rar
أطراف الغرائب والأفراد,http://shamela.ws/index.php/book/6083,http://shamela.ws/books/060/6083.rar
أخصر المختصرات,http://shamela.ws/index.php/book/6084,http://shamela.ws/books/060/6084.rar
النكت والفوائد السنية على مشكل المحرر,http://shamela.ws/index.php/book/6094,http://shamela.ws/books/060/6094.rar
مسائل الإمام أحمد رواية ابنه عبد الله,http://shamela.ws/index.php/book/6105,http://shamela.ws/books/061/6105.rar
مسائل الإمام أحمد رواية ابنه أبي الفضل صالح,http://shamela.ws/index.php/book/6106,http://shamela.ws/books/061/6106.rar
كشف المخدرات,http://shamela.ws/index.php/book/6115,http://shamela.ws/books/061/6115.rar
المسائل التي حلف عليها أحمد بن حنبل,http://shamela.ws/index.php/book/6117,http://shamela.ws/books/061/6117.rar
الإقناع للماوردي,http://shamela.ws/index.php/book/6120,http://shamela.ws/books/061/6120.rar
الإقناع في حل ألفاظ أبي شجاع,http://shamela.ws/index.php/book/6121,http://shamela.ws/books/061/6121.rar
السراج الوهاج,http://shamela.ws/index.php/book/6123,http://shamela.ws/books/061/6123.rar
المقدمة الحضرمية,http://shamela.ws/index.php/book/6125,http://shamela.ws/books/061/6125.rar
الوسيط في المذهب,http://shamela.ws/index.php/book/6128,http://shamela.ws/books/061/6128.rar
حلية العلماء في معرفة مذاهب الفقهاء,http://shamela.ws/index.php/book/6131,http://shamela.ws/books/061/6131.rar
خبايا الزوايا,http://shamela.ws/index.php/book/6133,http://shamela.ws/books/061/6133.rar
دقائق المنهاج,http://shamela.ws/index.php/book/6134,http://shamela.ws/books/061/6134.rar
غاية البيان شرح زبد ابن رسلان,http://shamela.ws/index.php/book/6136,http://shamela.ws/books/061/6136.rar
فتاوى ابن الصلاح,http://shamela.ws/index.php/book/6137,http://shamela.ws/books/061/6137.rar
كفاية الأخيار في حل غاية الاختصار,http://shamela.ws/index.php/book/6140,http://shamela.ws/books/061/6140.rar
نهاية الزين,http://shamela.ws/index.php/book/6146,http://shamela.ws/books/061/6146.rar
الحاوي الكبير,http://shamela.ws/index.php/book/6157,http://shamela.ws/books/061/6157.rar
الجامع الصغير وشرحه النافع الكبير,http://shamela.ws/index.php/book/6160,http://shamela.ws/books/061/6160.rar
