bookTitle,bookUrl,bok_file_Url
أول مرة أتدبر القرآن,http://shamela.ws/index.php/book/151045,http://shamela.ws/books/1510/151045.rar
الإجماع لابن المنذر ت أبي عبد الأعلى,http://shamela.ws/index.php/book/151100,http://shamela.ws/books/1511/151100.rar
من حاشية إبراهيم السقا على تفسير أبي السعود,http://shamela.ws/index.php/book/151103,http://shamela.ws/books/1511/151103.rar
الإجماع لابن المنذر ت فؤاد ط المسلم,http://shamela.ws/index.php/book/12445,http://shamela.ws/books/124/12445.rar
المجروحين لابن حبان ت حمدي,http://shamela.ws/index.php/book/151099,http://shamela.ws/books/1510/151099.rar
تفسير العثيمين - الزخرف,http://shamela.ws/index.php/book/132428,http://shamela.ws/books/1324/132428.rar
تفسير العثيمين - السجدة,http://shamela.ws/index.php/book/132429,http://shamela.ws/books/1324/132429.rar
تفسير العثيمين - سبأ,http://shamela.ws/index.php/book/150303,http://shamela.ws/books/1503/150303.rar
تفسير العثيمين - الشعراء,http://shamela.ws/index.php/book/150304,http://shamela.ws/books/1503/150304.rar
الإلمام بشرح عمدة الأحكام,http://shamela.ws/index.php/book/151007,http://shamela.ws/books/1510/151007.rar
المجرد في أسماء رجال سنن ابن ماجه,http://shamela.ws/index.php/book/151009,http://shamela.ws/books/1510/151009.rar
الرد على التعقيب الحثيث للشيخ عبد الله الحبشي,http://shamela.ws/index.php/book/151039,http://shamela.ws/books/1510/151039.rar
قرة العين في تلخيص تراجم رجال الصحيحين,http://shamela.ws/index.php/book/151040,http://shamela.ws/books/1510/151040.rar
النصيحة بالتحذير من تخريب «ابن عبد المنان» لكتب…,http://shamela.ws/index.php/book/150846,http://shamela.ws/books/1508/150846.rar
فتح الأقفال وحل الإشكال بشرح لامية الأفعال المشهور…,http://shamela.ws/index.php/book/133416,http://shamela.ws/books/1334/133416.rar
المسائل والأجوبة لابن قتيبة,http://shamela.ws/index.php/book/151010,http://shamela.ws/books/1510/151010.rar
البلاغة الصافية في المعاني والبيان والبديع,http://shamela.ws/index.php/book/151012,http://shamela.ws/books/1510/151012.rar
النظم البلاغي بين النظرية والتطبيق,http://shamela.ws/index.php/book/151013,http://shamela.ws/books/1510/151013.rar
خصائص النظم في «خصائص العربية» لابن جني,http://shamela.ws/index.php/book/151015,http://shamela.ws/books/1510/151015.rar
دلائل الإعجاز بين أبي سعيد السيرافي والجرجاني,http://shamela.ws/index.php/book/151016,http://shamela.ws/books/1510/151016.rar
فتح الكبير المتعال إعراب المعلقات العشر الطوال,http://shamela.ws/index.php/book/151017,http://shamela.ws/books/1510/151017.rar
من قضايا البلاغة والنقد عند عبد القادر الجرجاني,http://shamela.ws/index.php/book/151018,http://shamela.ws/books/1510/151018.rar
صون المنطق والكلام عن فني المنطق والكلام,http://shamela.ws/index.php/book/151019,http://shamela.ws/books/1510/151019.rar
جهد القريحة في تجريد النصيحة,http://shamela.ws/index.php/book/151020,http://shamela.ws/books/1510/151020.rar
زبد العلوم وصاحب المنطوق والمفهوم,http://shamela.ws/index.php/book/133413,http://shamela.ws/books/1334/133413.rar
الكفاية في التفسير بالمأثور والدراية,http://shamela.ws/index.php/book/151008,http://shamela.ws/books/1510/151008.rar
حاشية الصاوي على الشرح الصغير ط الحلبي,http://shamela.ws/index.php/book/150969,http://shamela.ws/books/1509/150969.rar
شرح أبيات مغني اللبيب,http://shamela.ws/index.php/book/150966,http://shamela.ws/books/1509/150966.rar
شرح «أدب القاضي للخصاف» للصدر الشهيد ت سرحان,http://shamela.ws/index.php/book/150967,http://shamela.ws/books/1509/150967.rar
الزيادة والإحسان في علوم القرآن,http://shamela.ws/index.php/book/150960,http://shamela.ws/books/1509/150960.rar
الفواكه العديدة في المسائل المفيدة,http://shamela.ws/index.php/book/150961,http://shamela.ws/books/1509/150961.rar
الكوكب الدري على جامع الترمذي,http://shamela.ws/index.php/book/150962,http://shamela.ws/books/1509/150962.rar
كشف المغطى من المعاني والألفاظ الواقعة في الموطا,http://shamela.ws/index.php/book/150963,http://shamela.ws/books/1509/150963.rar
معجم تيمور الكبير في الألفاظ العامية,http://shamela.ws/index.php/book/150964,http://shamela.ws/books/1509/150964.rar
الباعث الحثيث شرح اختصار علوم الحديث ط ابن الجوزي,http://shamela.ws/index.php/book/150481,http://shamela.ws/books/1504/150481.rar
أعجمي فالعب به,http://shamela.ws/index.php/book/150958,http://shamela.ws/books/1509/150958.rar
إتحاف الحثيث بإعراب ما يشكل من ألفاظ الحديث,http://shamela.ws/index.php/book/14469,http://shamela.ws/books/144/14469.rar
تفسير الثعلبي = الكشف والبيان عن تفسير القرآن ط…,http://shamela.ws/index.php/book/18686,http://shamela.ws/books/186/18686.rar
الإيمان الأوسط - ط ابن الجوزي,http://shamela.ws/index.php/book/20587,http://shamela.ws/books/205/20587.rar
غاية المنتهى في جمع الإقناع والمنتهى,http://shamela.ws/index.php/book/20589,http://shamela.ws/books/205/20589.rar
فتح العلام بشرح الإعلام بأحاديث الأحكام,http://shamela.ws/index.php/book/20590,http://shamela.ws/books/205/20590.rar
اصطلاح المذهب عند المالكية,http://shamela.ws/index.php/book/150934,http://shamela.ws/books/1509/150934.rar
الفكر العربي في عصر النهضة,http://shamela.ws/index.php/book/150935,http://shamela.ws/books/1509/150935.rar
المرشد إلى فهم أشعار العرب,http://shamela.ws/index.php/book/150936,http://shamela.ws/books/1509/150936.rar
المستشرقون لنجيب العقيقي,http://shamela.ws/index.php/book/150937,http://shamela.ws/books/1509/150937.rar
حاشية التوضيح والتصحيح لمشكلات كتاب التنقيح,http://shamela.ws/index.php/book/150938,http://shamela.ws/books/1509/150938.rar
حضارة العرب - غوستاف لوبون,http://shamela.ws/index.php/book/150939,http://shamela.ws/books/1509/150939.rar
جواهر الدرر في حل ألفاظ المختصر,http://shamela.ws/index.php/book/150676,http://shamela.ws/books/1506/150676.rar
حلية العلماء في معرفة مذاهب الفقهاء ط الرسالة الحديثة,http://shamela.ws/index.php/book/146126,http://shamela.ws/books/1461/146126.rar
مرقاة الصعود إلى سنن أبي داود,http://shamela.ws/index.php/book/150639,http://shamela.ws/books/1506/150639.rar
موسوعة محاسن الإسلام ورد شبهات اللئام,http://shamela.ws/index.php/book/146418,http://shamela.ws/books/1464/146418.rar
سلاسل الذهب,http://shamela.ws/index.php/book/150599,http://shamela.ws/books/1505/150599.rar
العدة في إعراب العمدة,http://shamela.ws/index.php/book/150600,http://shamela.ws/books/1506/150600.rar
تقويم اللسانين,http://shamela.ws/index.php/book/150601,http://shamela.ws/books/1506/150601.rar
الإعراب المفصل لكتاب الله المرتل,http://shamela.ws/index.php/book/150578,http://shamela.ws/books/1505/150578.rar
الحسبة في الإسلام,http://shamela.ws/index.php/book/132424,http://shamela.ws/books/1324/132424.rar
الحسبة لابن المبرد,http://shamela.ws/index.php/book/132425,http://shamela.ws/books/1324/132425.rar
الكنز الأكبر في الأمر بالمعروف والنهي عن المنكر…,http://shamela.ws/index.php/book/132427,http://shamela.ws/books/1324/132427.rar
رسالة عمر بن عثمان بن العباس الجرسيفي في الحسبة,http://shamela.ws/index.php/book/132434,http://shamela.ws/books/1324/132434.rar
ذوو الاحتياجات الخاصة في ضوء القرآن والسنة,http://shamela.ws/index.php/book/150305,http://shamela.ws/books/1503/150305.rar
ديوان عامر بن الطفيل,http://shamela.ws/index.php/book/149871,http://shamela.ws/books/1498/149871.rar
ديوان عمارة بن عقيل,http://shamela.ws/index.php/book/149872,http://shamela.ws/books/1498/149872.rar
ديوان قيس بن الخطيم,http://shamela.ws/index.php/book/149873,http://shamela.ws/books/1498/149873.rar
ديوان ليلى الأخيلية,http://shamela.ws/index.php/book/149874,http://shamela.ws/books/1498/149874.rar
ديوان الحارث بن حلزة اليشكري,http://shamela.ws/index.php/book/149875,http://shamela.ws/books/1498/149875.rar
تذهيب تهذيب الكمال في أسماء الرجال,http://shamela.ws/index.php/book/149213,http://shamela.ws/books/1492/149213.rar
لوامع الدرر في هتك استار المختصر,http://shamela.ws/index.php/book/149697,http://shamela.ws/books/1496/149697.rar
ديوان معاوية بن أبي سفيان,http://shamela.ws/index.php/book/149482,http://shamela.ws/books/1494/149482.rar
ديوان سلامة بن جندل,http://shamela.ws/index.php/book/149483,http://shamela.ws/books/1494/149483.rar
ديوان عمرو بن قميئة,http://shamela.ws/index.php/book/149481,http://shamela.ws/books/1494/149481.rar
ديوان سويد بن أبي كاهل اليشكري,http://shamela.ws/index.php/book/149485,http://shamela.ws/books/1494/149485.rar
ديوان ابن الخياط,http://shamela.ws/index.php/book/148537,http://shamela.ws/books/1485/148537.rar
ديوان ابن نباتة المصري,http://shamela.ws/index.php/book/148538,http://shamela.ws/books/1485/148538.rar
ديوان أبي الأسود الدؤلي,http://shamela.ws/index.php/book/148539,http://shamela.ws/books/1485/148539.rar
شعر أبي حية النميري,http://shamela.ws/index.php/book/148540,http://shamela.ws/books/1485/148540.rar
ديوان أبي دهبل الجمحي,http://shamela.ws/index.php/book/149016,http://shamela.ws/books/1490/149016.rar
منة المنعم في شرح صحيح مسلم,http://shamela.ws/index.php/book/149015,http://shamela.ws/books/1490/149015.rar
رياض النفوس في طبقات علماء القيروان وإفريقية,http://shamela.ws/index.php/book/148883,http://shamela.ws/books/1488/148883.rar
البحر المحيط الثجاج في شرح صحيح الإمام مسلم بن…,http://shamela.ws/index.php/book/148870,http://shamela.ws/books/1488/148870.rar
قرة عين المحتاج في شرح مقدمة صحيح مسلم بن الحجاج,http://shamela.ws/index.php/book/148896,http://shamela.ws/books/1488/148896.rar
جمهرة رسائل العرب في عصور العربية,http://shamela.ws/index.php/book/13658,http://shamela.ws/books/136/13658.rar
النبوغ المغربي في الأدب العربي,http://shamela.ws/index.php/book/148529,http://shamela.ws/books/1485/148529.rar
تاريخ الغزو الفكري والتعريب خلال مرحلة ما بين الحربين…,http://shamela.ws/index.php/book/148530,http://shamela.ws/books/1485/148530.rar
درء القول القبيح بالتحسين والتقبيح,http://shamela.ws/index.php/book/148531,http://shamela.ws/books/1485/148531.rar
شمس الله تشرق على الغرب = فضل العرب على أوروبا,http://shamela.ws/index.php/book/148532,http://shamela.ws/books/1485/148532.rar
مقالات الطناحي (صفحات في التراث والتراجم واللغة…,http://shamela.ws/index.php/book/148533,http://shamela.ws/books/1485/148533.rar
موائد الحيس في فوائد القيس,http://shamela.ws/index.php/book/148534,http://shamela.ws/books/1485/148534.rar
حماسة البحتري,http://shamela.ws/index.php/book/148535,http://shamela.ws/books/1485/148535.rar
ديوان ابن أبي حصينة,http://shamela.ws/index.php/book/148536,http://shamela.ws/books/1485/148536.rar
المهذب في اختصار السنن الكبير,http://shamela.ws/index.php/book/146127,http://shamela.ws/books/1461/146127.rar
السنن الكبرى للبيهقي ت التركي,http://shamela.ws/index.php/book/148486,http://shamela.ws/books/1484/148486.rar
جامع المسانيد لابن الجوزي,http://shamela.ws/index.php/book/148271,http://shamela.ws/books/1482/148271.rar
معجم الدخيل في اللغة العربية الحديثة ولهجاتها,http://shamela.ws/index.php/book/148181,http://shamela.ws/books/1481/148181.rar
الجامع الصحيح مما ليس في الصحيحين,http://shamela.ws/index.php/book/148097,http://shamela.ws/books/1480/148097.rar
المدخل إلى تقويم اللسان,http://shamela.ws/index.php/book/148096,http://shamela.ws/books/1480/148096.rar
مرشد ذوي الحجا والحاجة إلى سنن ابن ماجه والقول…,http://shamela.ws/index.php/book/148095,http://shamela.ws/books/1480/148095.rar
معجم تاريخ التراث الإسلامي في مكتبات العالم - المخطوطات…,http://shamela.ws/index.php/book/148091,http://shamela.ws/books/1480/148091.rar
التفسير بالبيان المتصل في القرآن الكريم,http://shamela.ws/index.php/book/148082,http://shamela.ws/books/1480/148082.rar
نقد الصحابة والتابعين للتفسير,http://shamela.ws/index.php/book/148083,http://shamela.ws/books/1480/148083.rar
الشاهد الشعري في تفسير القرآن الكريم أهميته، وأثره،…,http://shamela.ws/index.php/book/148084,http://shamela.ws/books/1480/148084.rar
التفسير المأمون على منهج التنزيل والصحيح المسنون,http://shamela.ws/index.php/book/147666,http://shamela.ws/books/1476/147666.rar
الوصايا العشر مع فضائل العشر,http://shamela.ws/index.php/book/147909,http://shamela.ws/books/1479/147909.rar
الأربعون النووية مع زيادات ابن رجب,http://shamela.ws/index.php/book/147927,http://shamela.ws/books/1479/147927.rar
ثلاث صلوات عظيمة مهجورة فأحيها يا عبد الله,http://shamela.ws/index.php/book/147912,http://shamela.ws/books/1479/147912.rar
مفتاح الوصول إلى بناء الفروع على الأصول,http://shamela.ws/index.php/book/147913,http://shamela.ws/books/1479/147913.rar
مثارات الغلط في الأدلة,http://shamela.ws/index.php/book/147914,http://shamela.ws/books/1479/147914.rar
السبيل إلى منهج أهل السنة والجماعة,http://shamela.ws/index.php/book/147594,http://shamela.ws/books/1475/147594.rar
منهج الدعوة في ضوء الواقع المعاصر,http://shamela.ws/index.php/book/147603,http://shamela.ws/books/1476/147603.rar
الروض النضر في ترجمة أدباء العصر,http://shamela.ws/index.php/book/13226,http://shamela.ws/books/132/13226.rar
التيسير في القراءات السبع ت الشغدلي,http://shamela.ws/index.php/book/147812,http://shamela.ws/books/1478/147812.rar
البعث والنشور للبيهقي ت الشوامي,http://shamela.ws/index.php/book/147811,http://shamela.ws/books/1478/147811.rar
الآيات القرآنية الواردة في الرد على البدع المتقابلة…,http://shamela.ws/index.php/book/147315,http://shamela.ws/books/1473/147315.rar
رسالة العكبري في أصول الفقه ت السبيعي,http://shamela.ws/index.php/book/147668,http://shamela.ws/books/1476/147668.rar
قاعدة مختصرة في قتال الكفار ومهادنتهم وتحريم قتلهم…,http://shamela.ws/index.php/book/147669,http://shamela.ws/books/1476/147669.rar
مسألة في توحيد الفلاسفة,http://shamela.ws/index.php/book/147670,http://shamela.ws/books/1476/147670.rar
اختيارات شيخ الإسلام ابن تيمية لابن عبد الهادي,http://shamela.ws/index.php/book/147673,http://shamela.ws/books/1476/147673.rar
اختيارات شيخ الإسلام ابن تيمية للبرهان ابن القيم,http://shamela.ws/index.php/book/147674,http://shamela.ws/books/1476/147674.rar
اختيارات شيخ الإسلام ابن تيمية لدى مترجميه,http://shamela.ws/index.php/book/147675,http://shamela.ws/books/1476/147675.rar
مطالع الدقائق في تحرير الجوامع والفوارق,http://shamela.ws/index.php/book/147671,http://shamela.ws/books/1476/147671.rar
جمهرة مقالات ورسائل الشيخ الإمام محمد الطاهر ابن…,http://shamela.ws/index.php/book/147597,http://shamela.ws/books/1475/147597.rar
منية الساجد بشرح بداية العابد وكفاية الزاهد,http://shamela.ws/index.php/book/147663,http://shamela.ws/books/1476/147663.rar
مناسك الحج لابن تيمية,http://shamela.ws/index.php/book/147665,http://shamela.ws/books/1476/147665.rar
أخصر المختصرات ط الركائز,http://shamela.ws/index.php/book/147656,http://shamela.ws/books/1476/147656.rar
الدلائل والإشارات على أخصر المختصرات,http://shamela.ws/index.php/book/147657,http://shamela.ws/books/1476/147657.rar
الروض المربع بشرح زاد المستنقع مختصر المقنع ط الركائز,http://shamela.ws/index.php/book/147658,http://shamela.ws/books/1476/147658.rar
الفتوحات الربانية بشرح الدرة المضية في علم القواعد…,http://shamela.ws/index.php/book/147659,http://shamela.ws/books/1476/147659.rar
الفوائد المرضية بشرح الدرة المضية في علم القواعد…,http://shamela.ws/index.php/book/147660,http://shamela.ws/books/1476/147660.rar
بداية العابد وكفاية الزهد ط الركائز,http://shamela.ws/index.php/book/147661,http://shamela.ws/books/1476/147661.rar
قواعد الأصول ومعاقد الفصول مختصر تحقيق الأمل في…,http://shamela.ws/index.php/book/147662,http://shamela.ws/books/1476/147662.rar
معجم أسر بريدة,http://shamela.ws/index.php/book/147374,http://shamela.ws/books/1473/147374.rar
درر الفرائد المستحسنة في شرح منظومة ابن الشحنة,http://shamela.ws/index.php/book/147320,http://shamela.ws/books/1473/147320.rar
الكتاب الفريد في إعراب القرآن المجيد,http://shamela.ws/index.php/book/147312,http://shamela.ws/books/1473/147312.rar
تحبير المختصر وهو الشرح الوسط لبهرام على مختصر…,http://shamela.ws/index.php/book/147313,http://shamela.ws/books/1473/147313.rar
القناعة في ما يحسن الإحاطة من أشراط الساعة,http://shamela.ws/index.php/book/127668,http://shamela.ws/books/1276/127668.rar
مختصر الإفادات في ربع العبادات والآداب وزيادات,http://shamela.ws/index.php/book/147311,http://shamela.ws/books/1473/147311.rar
البراهين المعتبرة في هدم قواعد المبتدعة,http://shamela.ws/index.php/book/145434,http://shamela.ws/books/1454/145434.rar
الإبهاج في شرح المنهاج ط دبي,http://shamela.ws/index.php/book/147104,http://shamela.ws/books/1471/147104.rar
التيه والمخرج,http://shamela.ws/index.php/book/147090,http://shamela.ws/books/1470/147090.rar
القنوت,http://shamela.ws/index.php/book/147094,http://shamela.ws/books/1470/147094.rar
صراع الفكر والاتباع,http://shamela.ws/index.php/book/147096,http://shamela.ws/books/1470/147096.rar
صفات الطائفة المنصورة ومفاهمها,http://shamela.ws/index.php/book/147097,http://shamela.ws/books/1470/147097.rar
منهج الاعتدال,http://shamela.ws/index.php/book/147099,http://shamela.ws/books/1470/147099.rar
أحكام رؤية الهلال,http://shamela.ws/index.php/book/147089,http://shamela.ws/books/1470/147089.rar
الردود المفحمة على منكري السنة المطهرة,http://shamela.ws/index.php/book/147091,http://shamela.ws/books/1470/147091.rar
الفجر فجران,http://shamela.ws/index.php/book/147093,http://shamela.ws/books/1470/147093.rar
حكم الإحرام من جده,http://shamela.ws/index.php/book/147095,http://shamela.ws/books/1470/147095.rar
مسألة تقديم وقت أذان الفجر، وتأخير توقيت العشاء,http://shamela.ws/index.php/book/147098,http://shamela.ws/books/1470/147098.rar
الوجيز في الفقه على مذهب الإمام أحمد بن حنبل,http://shamela.ws/index.php/book/147064,http://shamela.ws/books/1470/147064.rar
غذاء الأرواح بالمحادثة والمزاح,http://shamela.ws/index.php/book/147065,http://shamela.ws/books/1470/147065.rar
كشف النقاب عن مؤلفات الأصحاب,http://shamela.ws/index.php/book/147066,http://shamela.ws/books/1470/147066.rar
إضافات للنعت الأكمل لأصحاب الإمام أحمد بن حنبل,http://shamela.ws/index.php/book/147072,http://shamela.ws/books/1470/147072.rar
النعت الأكمل لأصحاب الإمام أحمد بن حنبل,http://shamela.ws/index.php/book/147073,http://shamela.ws/books/1470/147073.rar
الأطول شرح تلخيص مفتاح العلوم,http://shamela.ws/index.php/book/13680,http://shamela.ws/books/136/13680.rar
حاشية الدسوقي على مختصر المعاني,http://shamela.ws/index.php/book/147062,http://shamela.ws/books/1470/147062.rar
صحيح وضعيف تاريخ الطبري,http://shamela.ws/index.php/book/145435,http://shamela.ws/books/1454/145435.rar
أصل كلمة «شاطر»,http://shamela.ws/index.php/book/145421,http://shamela.ws/books/1454/145421.rar
التسويف في نشر الرسالة الجامعية، والتدقيق المبالغ…,http://shamela.ws/index.php/book/145422,http://shamela.ws/books/1454/145422.rar
التصغير في ألقاب الأسر,http://shamela.ws/index.php/book/145423,http://shamela.ws/books/1454/145423.rar
السمبوسة في كتب التراث,http://shamela.ws/index.php/book/145424,http://shamela.ws/books/1454/145424.rar
الموازنة بين «الفائق» للزمخشري (ت 538 هـ) و «النهاية»…,http://shamela.ws/index.php/book/145425,http://shamela.ws/books/1454/145425.rar
إن الله يزع بالسلطان ما لا يزع بالقرآن - تخريجا…,http://shamela.ws/index.php/book/145426,http://shamela.ws/books/1454/145426.rar
سبب تسمية «الشقة» بهذا الاسم,http://shamela.ws/index.php/book/145427,http://shamela.ws/books/1454/145427.rar
مجيء (أبو) في موضع نصب أو جر على الحكاية,http://shamela.ws/index.php/book/145428,http://shamela.ws/books/1454/145428.rar
مصطلحات أئمة الحديث الخاصة ويليه القرائن الموصلة…,http://shamela.ws/index.php/book/145429,http://shamela.ws/books/1454/145429.rar
منهج الدميري في كتابه حياة الحيوان,http://shamela.ws/index.php/book/145430,http://shamela.ws/books/1454/145430.rar
منهج العلامة القسطلاني (923 هـ) في كتابه: «إرشاد الساري…,http://shamela.ws/index.php/book/145431,http://shamela.ws/books/1454/145431.rar
ندب العيد,http://shamela.ws/index.php/book/145432,http://shamela.ws/books/1454/145432.rar
نواة المكتبة,http://shamela.ws/index.php/book/145433,http://shamela.ws/books/1454/145433.rar
بدائع الفوائد ط عالم الفوائد,http://shamela.ws/index.php/book/145410,http://shamela.ws/books/1454/145410.rar
مفتاح دار السعادة لابن القيم ط عالم الفوائد,http://shamela.ws/index.php/book/145411,http://shamela.ws/books/1454/145411.rar
صحيح سنن أبي داود ط غراس,http://shamela.ws/index.php/book/25881,http://shamela.ws/books/258/25881.rar
الرد على السبكي في مسألة تعليق الطلاق,http://shamela.ws/index.php/book/32384,http://shamela.ws/books/323/32384.rar
جامع المسائل لابن تيمية ط عالم الفوائد - المجموعة…,http://shamela.ws/index.php/book/145376,http://shamela.ws/books/1453/145376.rar
المقفى الكبير,http://shamela.ws/index.php/book/145334,http://shamela.ws/books/1453/145334.rar
تذكرة أولي النهى والعرفان بأيام الله الواحد الديان…,http://shamela.ws/index.php/book/145210,http://shamela.ws/books/1452/145210.rar
روضة التقرير في اختلاف القراءات بين الإرشاد والتيسير,http://shamela.ws/index.php/book/145211,http://shamela.ws/books/1452/145211.rar
لمعات التنقيح في شرح مشكاة المصابيح,http://shamela.ws/index.php/book/145212,http://shamela.ws/books/1452/145212.rar
التفسير والمفسرون في العصر الحديث - فضل عباس,http://shamela.ws/index.php/book/145333,http://shamela.ws/books/1453/145333.rar
الشرك في القديم والحديث,http://shamela.ws/index.php/book/145209,http://shamela.ws/books/1452/145209.rar
جامع تراث العلامة الألباني في المنهج والأحداث…,http://shamela.ws/index.php/book/145205,http://shamela.ws/books/1452/145205.rar
