bookTitle,bookUrl,bok_file_Url
عمدة الكتاب لأبي جعفر النحاس,http://shamela.ws/index.php/book/26803,http://shamela.ws/books/268/26803.rar
أدب النساء لعبد الملك بن حبيب,http://shamela.ws/index.php/book/26808,http://shamela.ws/books/268/26808.rar
تاريخ دنيسر,http://shamela.ws/index.php/book/26813,http://shamela.ws/books/268/26813.rar
كتاب الأربعين في إرشاد السائرين إلى منازل المتقين…,http://shamela.ws/index.php/book/26842,http://shamela.ws/books/268/26842.rar
الرباعي في الحديث لعبدالغني بن سعيد,http://shamela.ws/index.php/book/26844,http://shamela.ws/books/268/26844.rar
مشيخة أبي المنجى ابن اللتي,http://shamela.ws/index.php/book/26857,http://shamela.ws/books/268/26857.rar
التعازي لأبي الحسن المدائني,http://shamela.ws/index.php/book/26863,http://shamela.ws/books/268/26863.rar
الفتوة لأبي عبد الرحمن السلمي,http://shamela.ws/index.php/book/26864,http://shamela.ws/books/268/26864.rar
الجامع لابن وهب ت رفعت فوزي عبد المطلب,http://shamela.ws/index.php/book/26865,http://shamela.ws/books/268/26865.rar
منتقى من أخبار الأصمعي للربعي,http://shamela.ws/index.php/book/26875,http://shamela.ws/books/268/26875.rar
المنثور من الحكايات والسؤالات لابن طاهر المقدسي,http://shamela.ws/index.php/book/26876,http://shamela.ws/books/268/26876.rar
جزء من حديث الكلابي,http://shamela.ws/index.php/book/26877,http://shamela.ws/books/268/26877.rar
اللطائف من دقائق المعارف لأبي موسى المديني,http://shamela.ws/index.php/book/26878,http://shamela.ws/books/268/26878.rar
الوقوف والترجل من مسائل الإمام أحمد,http://shamela.ws/index.php/book/26883,http://shamela.ws/books/268/26883.rar
الترغيب والترهيب لقوام السنة,http://shamela.ws/index.php/book/26884,http://shamela.ws/books/268/26884.rar
المنظوم والمنثور من الحديث,http://shamela.ws/index.php/book/26886,http://shamela.ws/books/268/26886.rar
أسامي مشايخ البخاري لابن مندة,http://shamela.ws/index.php/book/26889,http://shamela.ws/books/268/26889.rar
إثبات الشفاعة للذهبي,http://shamela.ws/index.php/book/26890,http://shamela.ws/books/268/26890.rar
عوالي مسلم لابن حجر,http://shamela.ws/index.php/book/26891,http://shamela.ws/books/268/26891.rar
المقلق لابن الجوزي,http://shamela.ws/index.php/book/26892,http://shamela.ws/books/268/26892.rar
ترجمة مسلمة بن مخلد للمزي,http://shamela.ws/index.php/book/26893,http://shamela.ws/books/268/26893.rar
تعظيم الفتيا لابن الجوزي,http://shamela.ws/index.php/book/26894,http://shamela.ws/books/268/26894.rar
الكنى لمن لا يعرف له اسم للأزدي,http://shamela.ws/index.php/book/26895,http://shamela.ws/books/268/26895.rar
انتخاب كتاب من وافقت كنيته اسم أبيه للخطيب,http://shamela.ws/index.php/book/26906,http://shamela.ws/books/269/26906.rar
ذكر اسم كل صحابي ممن لا أخ له يوافق اسمه للأزدي,http://shamela.ws/index.php/book/26918,http://shamela.ws/books/269/26918.rar
من وافق اسمه اسم أبيه للأزدي,http://shamela.ws/index.php/book/26919,http://shamela.ws/books/269/26919.rar
من وافق اسمه كنية أبيه للأزدي,http://shamela.ws/index.php/book/26920,http://shamela.ws/books/269/26920.rar
الحج للماجشون,http://shamela.ws/index.php/book/26922,http://shamela.ws/books/269/26922.rar
الحج مما ليس في المدونة للعتبي,http://shamela.ws/index.php/book/26923,http://shamela.ws/books/269/26923.rar
الكلام على وصول القراءة للميت لابن سرور المقدسي,http://shamela.ws/index.php/book/26924,http://shamela.ws/books/269/26924.rar
نفحات النسمات في وصول إهداء الثواب للأموات للسروجي,http://shamela.ws/index.php/book/26925,http://shamela.ws/books/269/26925.rar
هدية الأحياء إلى الأموات وما يصل إليهم للهكاري,http://shamela.ws/index.php/book/26926,http://shamela.ws/books/269/26926.rar
أمهات النبي لابن حبيب,http://shamela.ws/index.php/book/26929,http://shamela.ws/books/269/26929.rar
التعليق الرشيق في التختم بالعقيق للناجي,http://shamela.ws/index.php/book/26961,http://shamela.ws/books/269/26961.rar
الأحاديث العيدية المسلسلة للسلفي,http://shamela.ws/index.php/book/26985,http://shamela.ws/books/269/26985.rar
الفوائد والأخبار لابن دريد,http://shamela.ws/index.php/book/26986,http://shamela.ws/books/269/26986.rar
جزء يشتمل على ثمانية وخمسين حديثا,http://shamela.ws/index.php/book/27085,http://shamela.ws/books/270/27085.rar
حديث السكن بن جميع,http://shamela.ws/index.php/book/27086,http://shamela.ws/books/270/27086.rar
حديث السلفي عن الأبهريين,http://shamela.ws/index.php/book/27087,http://shamela.ws/books/270/27087.rar
ختم كتاب الشفا لابن ناصر الدين,http://shamela.ws/index.php/book/27088,http://shamela.ws/books/270/27088.rar
رسالة البيهقي للجويني,http://shamela.ws/index.php/book/27089,http://shamela.ws/books/270/27089.rar
رسالة فيمن يدعي أن من ذرية العباس حمزة الخلف للناجي,http://shamela.ws/index.php/book/27090,http://shamela.ws/books/270/27090.rar
شروط النصارى لابن زبر الربعي,http://shamela.ws/index.php/book/27091,http://shamela.ws/books/270/27091.rar
عقلاء المجانين للضراب,http://shamela.ws/index.php/book/27093,http://shamela.ws/books/270/27093.rar
علة الحديث المسلسل في يوم العيدين لأبي محمد الجرجاني,http://shamela.ws/index.php/book/27094,http://shamela.ws/books/270/27094.rar
فضائل القرآن للضياء المقدسي,http://shamela.ws/index.php/book/27095,http://shamela.ws/books/270/27095.rar
فضل الجهاد لأحمد بن عبدالواحد المقدسي,http://shamela.ws/index.php/book/27096,http://shamela.ws/books/270/27096.rar
فوائد ابن الصلت وأبي أحمد الفرضي,http://shamela.ws/index.php/book/27098,http://shamela.ws/books/270/27098.rar
فوائد ابن بجير,http://shamela.ws/index.php/book/27099,http://shamela.ws/books/270/27099.rar
مجلس في التواضع للجوهري,http://shamela.ws/index.php/book/27100,http://shamela.ws/books/271/27100.rar
مجلس من حديث ابن العطار,http://shamela.ws/index.php/book/27101,http://shamela.ws/books/271/27101.rar
مسلسل العيدين للصيرفي,http://shamela.ws/index.php/book/27102,http://shamela.ws/books/271/27102.rar
مشيخة ابن إمام الصخرة,http://shamela.ws/index.php/book/27103,http://shamela.ws/books/271/27103.rar
مشيخة أبي حفص المراغي,http://shamela.ws/index.php/book/27104,http://shamela.ws/books/271/27104.rar
منتخب من كتاب الشعراء لأبي نعيم الأصبهاني,http://shamela.ws/index.php/book/27105,http://shamela.ws/books/271/27105.rar
وفاة الشيوخ الذين أدركهم البغوي,http://shamela.ws/index.php/book/27106,http://shamela.ws/books/271/27106.rar
فتاوى الشبكة الإسلامية,http://shamela.ws/index.php/book/27107,http://shamela.ws/books/271/27107.rar
منتخب من صحاح الجوهري,http://shamela.ws/index.php/book/28100,http://shamela.ws/books/281/28100.rar
مقامات السيوطي,http://shamela.ws/index.php/book/28112,http://shamela.ws/books/281/28112.rar
مقامات بديع الزمان الهمذاني,http://shamela.ws/index.php/book/28113,http://shamela.ws/books/281/28113.rar
مكفرات الذنوب وموجبات الجنة,http://shamela.ws/index.php/book/28114,http://shamela.ws/books/281/28114.rar
من غاب عنه المطرب,http://shamela.ws/index.php/book/28115,http://shamela.ws/books/281/28115.rar
نزهة المجالس ومنتخب النفائس,http://shamela.ws/index.php/book/28168,http://shamela.ws/books/281/28168.rar
نسب عدنان وقحطان,http://shamela.ws/index.php/book/28170,http://shamela.ws/books/281/28170.rar
المعجم الأوسط,http://shamela.ws/index.php/book/28171,http://shamela.ws/books/281/28171.rar
نسب معد واليمن الكبير,http://shamela.ws/index.php/book/28172,http://shamela.ws/books/281/28172.rar
نشوة السكران من صهباء تذكار الغزلان,http://shamela.ws/index.php/book/28173,http://shamela.ws/books/281/28173.rar
نشوة الطرب في تاريخ جاهلية العرب,http://shamela.ws/index.php/book/28174,http://shamela.ws/books/281/28174.rar
نفح الأزهار في منتخبات الأشعار,http://shamela.ws/index.php/book/28175,http://shamela.ws/books/281/28175.rar
نقد الشعر,http://shamela.ws/index.php/book/28181,http://shamela.ws/books/281/28181.rar
نكث الهميان في نكت العميان,http://shamela.ws/index.php/book/28182,http://shamela.ws/books/281/28182.rar
هواتف الجنان للخرائطي,http://shamela.ws/index.php/book/28183,http://shamela.ws/books/281/28183.rar
الهواتف = هواتف الجنان لابن أبي الدنيا,http://shamela.ws/index.php/book/28237,http://shamela.ws/books/282/28237.rar
الأخبار الموفقيات للزبير بن بكار,http://shamela.ws/index.php/book/28453,http://shamela.ws/books/284/28453.rar
معجم أصحاب القاضي أبي علي الصدفي,http://shamela.ws/index.php/book/28740,http://shamela.ws/books/287/28740.rar
نسخة السري بن سهل,http://shamela.ws/index.php/book/28851,http://shamela.ws/books/288/28851.rar
من حديث عبد الصمد الطستي,http://shamela.ws/index.php/book/28853,http://shamela.ws/books/288/28853.rar
حديث الضب الذي تكلم بين يدي النبي للطبراني,http://shamela.ws/index.php/book/28925,http://shamela.ws/books/289/28925.rar
مسند أبي حنيفة رواية الحصكفي,http://shamela.ws/index.php/book/29120,http://shamela.ws/books/291/29120.rar
الزهد للمعافى بن عمران الموصلي,http://shamela.ws/index.php/book/29289,http://shamela.ws/books/292/29289.rar
السير لأبي إسحاق الفزاري,http://shamela.ws/index.php/book/29344,http://shamela.ws/books/293/29344.rar
وصل بلاغات الموطأ ابن الصلاح,http://shamela.ws/index.php/book/29413,http://shamela.ws/books/294/29413.rar
أحاديث صحيحة مما رواه مسلم بن الحجاج بين المصطفى…,http://shamela.ws/index.php/book/29428,http://shamela.ws/books/294/29428.rar
خمسة أحاديث مسلسلات لضياء الدين المقدسي,http://shamela.ws/index.php/book/29449,http://shamela.ws/books/294/29449.rar
ذكر المصافحة لضياء الدين المقدسي,http://shamela.ws/index.php/book/29458,http://shamela.ws/books/294/29458.rar
جزء حديث المتبايعين بالخيار,http://shamela.ws/index.php/book/29464,http://shamela.ws/books/294/29464.rar
الأحاديث الستة العراقية,http://shamela.ws/index.php/book/29466,http://shamela.ws/books/294/29466.rar
عوالي أبي بكر بن عبد الدائم,http://shamela.ws/index.php/book/29481,http://shamela.ws/books/294/29481.rar
التوسعة على العيال لأبي زرعة,http://shamela.ws/index.php/book/29509,http://shamela.ws/books/295/29509.rar
أمالي الأذكار في فضل صلاة التسبيح,http://shamela.ws/index.php/book/29563,http://shamela.ws/books/295/29563.rar
الأربعون من رواية مالك عن نافع للسيوطي,http://shamela.ws/index.php/book/29569,http://shamela.ws/books/295/29569.rar
الأحاديث التساعية لابن جماعة,http://shamela.ws/index.php/book/29617,http://shamela.ws/books/296/29617.rar
كتاب الأربعين في فضل الدعاء والداعين,http://shamela.ws/index.php/book/29639,http://shamela.ws/books/296/29639.rar
من حديث ابن حذلم,http://shamela.ws/index.php/book/29651,http://shamela.ws/books/296/29651.rar
حديث ابن أبي المكارم,http://shamela.ws/index.php/book/29653,http://shamela.ws/books/296/29653.rar
نسخة الزبير بن عدي,http://shamela.ws/index.php/book/29699,http://shamela.ws/books/296/29699.rar
أحاديث السري بن يحيى,http://shamela.ws/index.php/book/29701,http://shamela.ws/books/297/29701.rar
جزء القاسم بن موسى الأشيب,http://shamela.ws/index.php/book/29702,http://shamela.ws/books/297/29702.rar
جزء آدم بن أبي إياس,http://shamela.ws/index.php/book/29703,http://shamela.ws/books/297/29703.rar
حديث أبي اليمان,http://shamela.ws/index.php/book/29704,http://shamela.ws/books/297/29704.rar
حديث خالد بن مرداس السراج,http://shamela.ws/index.php/book/29705,http://shamela.ws/books/297/29705.rar
الثامن من أجزاء أبي علي بن شاذان,http://shamela.ws/index.php/book/29707,http://shamela.ws/books/297/29707.rar
الثاني من حديث سفيان بن عيينة للطائي,http://shamela.ws/index.php/book/29708,http://shamela.ws/books/297/29708.rar
حديث بشر بن مطر,http://shamela.ws/index.php/book/29709,http://shamela.ws/books/297/29709.rar
مسند أبي أمية الطرسوسي,http://shamela.ws/index.php/book/29711,http://shamela.ws/books/297/29711.rar
فوائد منتقاة من حديث أبي شعيب الحراني,http://shamela.ws/index.php/book/29712,http://shamela.ws/books/297/29712.rar
فوائد أبي علي المدائني,http://shamela.ws/index.php/book/29713,http://shamela.ws/books/297/29713.rar
حديث أبي عبد الله الأنصاري,http://shamela.ws/index.php/book/29714,http://shamela.ws/books/297/29714.rar
حكايات شعبة بن الحجاج,http://shamela.ws/index.php/book/29715,http://shamela.ws/books/297/29715.rar
مجلسان لأبي بكر العنبري,http://shamela.ws/index.php/book/29716,http://shamela.ws/books/297/29716.rar
الأول من حديث ابن حذلم,http://shamela.ws/index.php/book/29720,http://shamela.ws/books/297/29720.rar
أمالي أبي بكر النجاد,http://shamela.ws/index.php/book/29721,http://shamela.ws/books/297/29721.rar
حديث أبي القاسم الكناني,http://shamela.ws/index.php/book/29722,http://shamela.ws/books/297/29722.rar
حكايات عن أبي الشيخ الأصبهاني,http://shamela.ws/index.php/book/29724,http://shamela.ws/books/297/29724.rar
حديث أبي القاسم الحلبي,http://shamela.ws/index.php/book/29725,http://shamela.ws/books/297/29725.rar
أحاديث أبي عبد الله الرازي,http://shamela.ws/index.php/book/29726,http://shamela.ws/books/297/29726.rar
أحاديث منتقاة في غرائب ألفاظ رسول الله مما يحتاج…,http://shamela.ws/index.php/book/29727,http://shamela.ws/books/297/29727.rar
جزء القاضي أبي القاسم الميانجي,http://shamela.ws/index.php/book/29728,http://shamela.ws/books/297/29728.rar
حديث أبي الحسن السكري,http://shamela.ws/index.php/book/29732,http://shamela.ws/books/297/29732.rar
الأحاديث المائة الشريحية,http://shamela.ws/index.php/book/29734,http://shamela.ws/books/297/29734.rar
أمالي ابن منده- رواية البزاني,http://shamela.ws/index.php/book/29737,http://shamela.ws/books/297/29737.rar
الموافقات العوالي للضياء المقدسي_2,http://shamela.ws/index.php/book/29738,http://shamela.ws/books/297/29738.rar
حديث أبي الحسين بن المظفر,http://shamela.ws/index.php/book/29739,http://shamela.ws/books/297/29739.rar
مجلس يوم الجمعة,http://shamela.ws/index.php/book/29744,http://shamela.ws/books/297/29744.rar
جزء من حديث النعالي,http://shamela.ws/index.php/book/29746,http://shamela.ws/books/297/29746.rar
ثلاثة مجالس من أمالي أبي سعيد النقاش,http://shamela.ws/index.php/book/29747,http://shamela.ws/books/297/29747.rar
حديث أبي الحسين بن العالي,http://shamela.ws/index.php/book/29749,http://shamela.ws/books/297/29749.rar
فوائد أبي علي بن فضالة,http://shamela.ws/index.php/book/29750,http://shamela.ws/books/297/29750.rar
جزء الحسن بن شاذان,http://shamela.ws/index.php/book/29751,http://shamela.ws/books/297/29751.rar
جزء ابن باكويه,http://shamela.ws/index.php/book/29752,http://shamela.ws/books/297/29752.rar
أربعون حديثا من الجزء الرابع من كتاب الطب,http://shamela.ws/index.php/book/29766,http://shamela.ws/books/297/29766.rar
فوائد أبي عبد الله الفراء,http://shamela.ws/index.php/book/29767,http://shamela.ws/books/297/29767.rar
مجموع تخريج شمس الدين المقدسي,http://shamela.ws/index.php/book/29768,http://shamela.ws/books/297/29768.rar
أحاديث عوالي وفوائد منتقاة وإنشادات,http://shamela.ws/index.php/book/29769,http://shamela.ws/books/297/29769.rar
مجلسان من أمالي الجوهري_3,http://shamela.ws/index.php/book/29770,http://shamela.ws/books/297/29770.rar
مجلسان من أمالي الجوهري_1,http://shamela.ws/index.php/book/29771,http://shamela.ws/books/297/29771.rar
الأربعون المستخرجة من الصحاح من روايات المحمدين,http://shamela.ws/index.php/book/29772,http://shamela.ws/books/297/29772.rar
مسموعات أبي محمد رزق الله التميمي,http://shamela.ws/index.php/book/29773,http://shamela.ws/books/297/29773.rar
المجلس 121 من أمالي أبي الفتح المقدسي,http://shamela.ws/index.php/book/29774,http://shamela.ws/books/297/29774.rar
الفوائد الحسان الصحاح والغرائب,http://shamela.ws/index.php/book/29775,http://shamela.ws/books/297/29775.rar
أنوار الهلالين في التعقبات على الجلالين,http://shamela.ws/index.php/book/10845,http://shamela.ws/books/108/10845.rar
أهداف دعوة الشيخ محمد بن عبد الوهاب,http://shamela.ws/index.php/book/10847,http://shamela.ws/books/108/10847.rar
أهدى سبيل إلى علمي الخليل,http://shamela.ws/index.php/book/10860,http://shamela.ws/books/108/10860.rar
أهمية العناية بالتفسير والحديث والفقه,http://shamela.ws/index.php/book/10871,http://shamela.ws/books/108/10871.rar
المحيط البرهاني في الفقه النعماني,http://shamela.ws/index.php/book/10875,http://shamela.ws/books/108/10875.rar
رحلة ابن جبير ط دار الهلال,http://shamela.ws/index.php/book/10883,http://shamela.ws/books/108/10883.rar
صحح نسختك من تهذيب الكمال,http://shamela.ws/index.php/book/10884,http://shamela.ws/books/108/10884.rar
منحة القريب المجيب في الرد على عباد الصليب,http://shamela.ws/index.php/book/10895,http://shamela.ws/books/108/10895.rar
نقض كلام المفترين على الحنابلة السلفيين,http://shamela.ws/index.php/book/10896,http://shamela.ws/books/108/10896.rar
أهمية دراسة السيرة النبوية للمعلمين,http://shamela.ws/index.php/book/10898,http://shamela.ws/books/108/10898.rar
أهمية دراسة السيرة النبوية والعناية بها في حياة…,http://shamela.ws/index.php/book/10899,http://shamela.ws/books/108/10899.rar
أهوال القبور وأحوال أهلها إلى النشور,http://shamela.ws/index.php/book/10900,http://shamela.ws/books/109/10900.rar
آيات متشابهات الألفاظ في القرآن الكريم وكيف التمييز…,http://shamela.ws/index.php/book/10901,http://shamela.ws/books/109/10901.rar
رجال صحيح البخاري = الهداية والإرشاد في معرفة أهل…,http://shamela.ws/index.php/book/10902,http://shamela.ws/books/109/10902.rar
الوحي والإنسان - قراءة معرفية,http://shamela.ws/index.php/book/10903,http://shamela.ws/books/109/10903.rar
سير أعلام النبلاء ط الرسالة,http://shamela.ws/index.php/book/10906,http://shamela.ws/books/109/10906.rar
العدة شرح العمدة,http://shamela.ws/index.php/book/10908,http://shamela.ws/books/109/10908.rar
العمدة في محاسن الشعر وآدابه,http://shamela.ws/index.php/book/10909,http://shamela.ws/books/109/10909.rar
القاعدة الذهبية لا ضرر ولا ضرار,http://shamela.ws/index.php/book/10910,http://shamela.ws/books/109/10910.rar
القوافي للتنوخي,http://shamela.ws/index.php/book/10911,http://shamela.ws/books/109/10911.rar
الكواكب السائرة بأعيان المئة العاشرة,http://shamela.ws/index.php/book/10912,http://shamela.ws/books/109/10912.rar
المؤتلف والمختلف في أسماء الشعراء,http://shamela.ws/index.php/book/10913,http://shamela.ws/books/109/10913.rar
المختار من شعر شعراء الأندلس,http://shamela.ws/index.php/book/10914,http://shamela.ws/books/109/10914.rar
إيجاز التعريف في علم التصريف,http://shamela.ws/index.php/book/10915,http://shamela.ws/books/109/10915.rar
المقابسات,http://shamela.ws/index.php/book/10916,http://shamela.ws/books/109/10916.rar
المقصد لتلخيص ما في المرشد,http://shamela.ws/index.php/book/10917,http://shamela.ws/books/109/10917.rar
المقنع في رسم مصاحف الأمصار,http://shamela.ws/index.php/book/10918,http://shamela.ws/books/109/10918.rar
النقط,http://shamela.ws/index.php/book/10920,http://shamela.ws/books/109/10920.rar
الوفيات لابن قنفذ,http://shamela.ws/index.php/book/10921,http://shamela.ws/books/109/10921.rar
بشارة المحبوب بتكفير الذنوب,http://shamela.ws/index.php/book/10922,http://shamela.ws/books/109/10922.rar
بشرى الكئيب بلقاء الحبيب,http://shamela.ws/index.php/book/10924,http://shamela.ws/books/109/10924.rar
تاريخ بيت المقدس,http://shamela.ws/index.php/book/10927,http://shamela.ws/books/109/10927.rar
تنبيه الغافلين وإرشاد الجاهلين,http://shamela.ws/index.php/book/10929,http://shamela.ws/books/109/10929.rar
انيس الفقهاء في تعريفات الألفاظ المتداولة بين…,http://shamela.ws/index.php/book/10930,http://shamela.ws/books/109/10930.rar
تنبيه النائم الغمر على مواسم العمر,http://shamela.ws/index.php/book/11023,http://shamela.ws/books/110/11023.rar
الفوائد المنتقاة المسماة بمشيخة الموصل لابن أبي…,http://shamela.ws/index.php/book/11026,http://shamela.ws/books/110/11026.rar
قرى الضيف لابن أبي الدنيا,http://shamela.ws/index.php/book/11030,http://shamela.ws/books/110/11030.rar
طرح التثريب في شرح التقريب,http://shamela.ws/index.php/book/11036,http://shamela.ws/books/110/11036.rar
حديث يحيى بن معين رواية أبي منصور الشيباني,http://shamela.ws/index.php/book/11037,http://shamela.ws/books/110/11037.rar
تهافت الفلاسفة,http://shamela.ws/index.php/book/11055,http://shamela.ws/books/110/11055.rar
ثمرات الأوراق في المحاضرات,http://shamela.ws/index.php/book/11056,http://shamela.ws/books/110/11056.rar
الكلام على حديث امرأتي لا ترد يد لامس لابن حجر -…,http://shamela.ws/index.php/book/11057,http://shamela.ws/books/110/11057.rar
حق الجار,http://shamela.ws/index.php/book/11064,http://shamela.ws/books/110/11064.rar
بأي عقل ودين يكون التفجير والتدمير جهادا؟! ويحكم…,http://shamela.ws/index.php/book/11066,http://shamela.ws/books/110/11066.rar
ببلوغرافيا لكتب الحديث والسنة بالغة الإنكليزية,http://shamela.ws/index.php/book/11067,http://shamela.ws/books/110/11067.rar
أخبار الحمقى والمغفلين,http://shamela.ws/index.php/book/11068,http://shamela.ws/books/110/11068.rar
بحوث وفتاوى في المسح على الخفين,http://shamela.ws/index.php/book/11069,http://shamela.ws/books/110/11069.rar
بعض فوائد صلح الحديبية (مطبوع ضمن مؤلفات الشيخ…,http://shamela.ws/index.php/book/11070,http://shamela.ws/books/110/11070.rar
بغية المرتاد في الرد على المتفلسفة والقرامطة والباطنية,http://shamela.ws/index.php/book/11071,http://shamela.ws/books/110/11071.rar
بيان المحجة في الرد على اللجة (مطبوع ضمن الرسائل…,http://shamela.ws/index.php/book/11073,http://shamela.ws/books/110/11073.rar
بيان كلمة التوحيد والرد على الكشميري عبد المحمود…,http://shamela.ws/index.php/book/11074,http://shamela.ws/books/110/11074.rar
بناء المجتمع الإسلامي,http://shamela.ws/index.php/book/11075,http://shamela.ws/books/110/11075.rar
تأثر الدعوات الإصلاحية في أندونيسيا بدعوة الشيخ…,http://shamela.ws/index.php/book/11076,http://shamela.ws/books/110/11076.rar
تاريخ جرجان,http://shamela.ws/index.php/book/11077,http://shamela.ws/books/110/11077.rar
تأسيس التقديس في كشف تلبيس داود بن جرجيس,http://shamela.ws/index.php/book/11079,http://shamela.ws/books/110/11079.rar
